Topic,Count,Name,Representation,Representative_Docs
80,18,80_reputation_negative_public opinion_opinion,"['reputation', 'negative', 'public opinion', 'opinion', 'perception', 'public', 'sentiment', 'negative public', 'public perception', 'industry adverse', 'relating public', 'negative impact']","['Negative public perception and investor sentiment regarding our business and the oil and gas industry as a whole could adversely affect our business, operations, and our ability to attract capital.', 'Negative impacts from a compromised reputation or changes in public opinion (including with respect to the production, transportation and use of hydrocarbons generally) could include increased regulatory oversight, delays in obtaining, or challenges to, regulatory approvals with respect to growth projects, blockades, project cancellations, difficulty securing financing, revenue loss, reduction in customer base, and decreased value of our securities and our business.', 'Factors that could have a negative impact on our reputation include an operating incident or significant cybersecurity disruption; changes in consumer views concerning our products; a perception by investors or others that the Corporation is making insufficient progress with respect to our ambition to lead in the energy transition, or that pursuit of this ambition may result in allocation of capital to investments with reduced returns; and other adverse events such as those described in this Item 1A. Negative impacts on our reputation could in turn make it more difficult for us to compete successfully for new opportunities, obtain necessary regulatory approvals, obtain financing, attract talent, or could reduce consumer demand for our branded products.']"
81,17,81_substantial capital_expect_capital expenditures_expenditures,"['substantial capital', 'expect', 'capital expenditures', 'expenditures', 'substantial', 'make', 'require substantial', 'capital', 'allocated', 'expect continue', 'acquisition', 'acquire develop']","['We make and expect to make substantial capital expenditures in connection with our development and production projects.', 'We make and expect to continue to make substantial capital expenditures for the development and acquisition of natural gas, NGLs and oil reserves.', 'We make and expect to continue to make substantial capital expenditures in our business for the development, exploitation, production and acquisition of crude oil and natural gas reserves.']"
82,17,82_locations_drilling locations_scheduled_susceptible uncertainties,"['locations', 'drilling locations', 'scheduled', 'susceptible uncertainties', 'identified', 'materially alter', 'susceptible', 'making susceptible', 'uncertainties materially', 'drilling', 'alter', 'locations scheduled']","['Our identified drilling locations are scheduled over several years, making them susceptible to uncertainties and lease expirations that could materially alter our plans.', 'Our drilling locations are scheduled out over many years, making them susceptible to uncertainties that could materially alter the occurrence or timing of when they are drilled, if at all.', 'Our identified drilling locations are scheduled over several years, making them susceptible to uncertainties that could materially alter the occurrence or timing of their drilling.']"
83,17,83_convertible notes_earnings_convertible_fair,"['convertible notes', 'earnings', 'convertible', 'fair', 'derivative instruments', 'non cash', 'constitutes', 'charge earnings', 'significantly result', 'fair value', 'notes', 'instruments']","['Accordingly, our earnings may fluctuate significantly as a result of changes in the fair market value of our derivative instruments, including a decrease in earnings if the price of commodities increases above the price of hedges that we have in place.', 'Accordingly, our earnings may fluctuate significantly as a result of changes in the fair value of our derivative instruments.', 'Accordingly, our earnings may fluctuate significantly as a result of changes in the fair value of our derivative instruments.']"
84,17,84_dividends_board directors_board_directors,"['dividends', 'board directors', 'board', 'directors', 'payment', 'considerations', 'payment dividends', 'discretion', 'discretion board', 'relevant', 'declare', 'capital requirements']","['Such payments will depend on, among other things, our available cash, earnings, financial condition, capital requirements, level of indebtedness, stock price, statutory and contractual restrictions applicable to the payment of dividends and other considerations that our Board of Directors deems relevant.', 'Any payment of future dividends will be at the discretion of our board of directors and will depend on, among other things, our earnings, financial condition, capital requirements, level of indebtedness, statutory and contractual restrictions applying to the payment of dividends and other considerations that our board of directors deems relevant.', 'Any payment of future dividends will be at the discretion of our Board of Directors and will depend on, among other things, our earnings, financial condition, capital requirements, level of indebtedness, statutory and contractual restrictions applicable to the payment of dividends and other considerations that our Board of Directors deems relevant.']"
85,17,85_capital_fund_access external_external financing,"['capital', 'fund', 'access external', 'external financing', 'external', 'financing', 'capital necessary', 'additional capital', 'raise additional', 'raise', 'sufficient', 'fund capital']","['If cash generated by operations or cash available under the revolving credit facility is not sufficient to meet our capital requirements, the failure to obtain additional financing could result in a curtailment of our operations relating to development of our drilling locations, which in turn could lead to a possible expiration of our leases and a decline in our estimated net proved reserves, and could adversely affect our business, financial condition and results of operations.', 'If cash flows from operations, cash on hand and available capacity under our credit facility are not sufficient to fund our capital program, we may be required to seek external financing or to delay or reduce our exploration and development activities, which could impact production, revenues and reserves.', 'If our cash flows from operations or the borrowing capacity under our credit facility are insufficient to fund our capital expenditures and we are unable to obtain the capital necessary for our planned capital budget or our operations, we could be required to curtail our operations and the development of our properties, which in turn could lead to a decline in our reserves and production, and could adversely affect our business, results of operations and financial position.']"
86,17,86_water_dispose_recycle_water use,"['water', 'dispose', 'recycle', 'water use', 'amounts water', 'adequate supplies', 'supplies water', 'operations unable', 'sufficient amounts', 'water drilling', 'unable', 'ability produce']","['We may be unable to acquire adequate supplies of water for our drilling and hydraulic fracturing operations or unable to dispose of the water we use at a reasonable cost and pursuant to applicable environmental rules.', 'See Risks Related to our OperationsIf we are unable to acquire adequate supplies of water for our drilling and hydraulic fracturing operations or are unable to dispose of the water we use at a reasonable cost and pursuant to applicable environmental rules, our ability to produce oil and natural gas commercially and in commercial quantities could be impaired.', 'If we are unable to acquire adequate supplies of water for our drilling and hydraulic fracturing operations or are unable to dispose of the water we use at a reasonable cost and pursuant to applicable environmental rules, our ability to produce oil and natural gas commercially and in commercial quantities could be impaired.']"
87,17,87_additional reserves_able develop_exploit acquire_reserves replace,"['additional reserves', 'able develop', 'exploit acquire', 'reserves replace', 'developed produced', 'developed', 'develop exploit', 'replace current', 'exploit', 'future production', 'replace', 'acceptable']","['We may not be able to develop, exploit, find or acquire sufficient additional reserves to replace our current and future production.', 'We may not be able to develop, exploit, find or acquire sufficient additional reserves to replace our current and future production.', 'We may not be able to develop, exploit, find or acquire additional reserves to replace our current and future production at acceptable costs.']"
88,16,88_indemnification_contractual_entitled_warranties,"['indemnification', 'contractual', 'entitled', 'warranties', 'representations warranties', 'environmental liabilities', 'liabilities', 'representations', 'pre closing', 'closing', 'pre', 'interests properties']","['We may not be entitled to contractual indemnification for pre-closing liabilities, including environmental liabilities.', 'We often assume certain liabilities, and we may not be entitled to contractual indemnification for pre-closing liabilities, including environmental liabilities, and our contractual indemnification may not be effective.', 'We often assume certain liabilities, and we may not be entitled to contractual indemnification for pre-closing liabilities, including environmental liabilities, and our contractual indemnification may not be effective.']"
89,16,89_opec_russia_domestic_global,"['opec', 'russia', 'domestic', 'global', 'worldwide', 'global oil', 'countries', 'price availability', 'conditions', 'energy', 'economic conditions', 'ukraine']","['These factors include, but are not limited to, the following: changes in supply and demand for oil and natural gas; the actions of the Organization of the Petroleum Exporting Countries; speculation as to the future price of oil and natural gas and the speculative trading of oil and natural gas futures contracts; global economic conditions; political and economic conditions, including embargoes in oilproducing countries or affecting other oilproducing activities, particularly in the Middle East, Africa, Russia and Central and South America; the continued threat of terrorism and the impact of military and other action, including US. military operations outside the United States; the level of global oil and natural gas exploration and production activity; the level of global oil inventories and oil refining capacities; weather conditions and natural or manmade disasters; technological advances affecting energy consumption; governmental regulations and taxation policies; proximity and capacity of transportation facilities; the development and exploitation of alternative fuels or energy sources; the price and availability of competitors supplies of oil and natural gas; andthe price, availability or mandated use of alternative fuels or energy sources.', 'These factors include, but are not limited to, the following: the domestic and foreign supply of, and demand for, oil and natural gas; the actions of OPEC+ and state-controlled oil companies relating to oil price and production controls; the prices and availability of competitors supplies of oil and natural gas; the price and quantity of foreign imports; the impact of US. dollar exchange rates; domestic and foreign governmental regulations and taxes; speculative trading of oil and natural gas futures contracts; the availability, proximity and capacity of gathering, processing and transportation systems for oil, natural gas and NGLs and gathering and disposal systems for produced water; the availability of refining capacity; the prices and availability of alternative fuel sources; weather conditions and natural disasters; political conditions in or affecting oil and natural gas producing regions or countries, including the United States, the Middle East, South America, Russia, Ukraine and China; domestic or global health concerns, including the outbreak of contagious or pandemic diseases, such as COVID-19; the continued threat of terrorism and the impact of military action and civil unrest; public pressure on, and legislative and regulatory interest within, federal, state and local governments to stop, significantly limit or regulate oil and natural gas operations, including hydraulic fracturing activities; the level of global oil and natural gas inventories and exploration and production activity; the impact of energy conservation efforts; technological advances affecting energy consumption; andoverall worldwide economic conditions.', 'These factors include the following: worldwide and regional economic conditions impacting the global supply and demand for crude oil, natural gas and NGLs; the actions of the Organization of Petroleum Exporting Countries (OPEC) and other non-OPEC oil-producing countries, including Russia; the price and quantity of imports of foreign crude oil, natural gas and NGLs; 31Table of Contentspolitical conditions in or affecting other crude oil, natural gas and NGL producing countries, including the current conflicts in and among the Middle East and conditions in South America, China, India and Russia; the level of global exploration and production; the level of global crude oil, natural gas and NGL inventories; events that impact global market demand, including impacts from global health epidemics and concerns, such as the COVID-19 pandemic; localized supply and demand fundamentals and regional, domestic and international transportation availability; weather conditions and natural disasters; domestic and foreign governmental regulations and policies, including environmental requirements; speculation as to future commodity prices and the speculative trading of crude oil and natural gas futures contracts; stockholder activism or activities by non-governmental organizations to limit certain sources of funding for the energy sector or restrict the exploration, development and production of crude oil, natural gas and NGLs and related infrastructure; price and availability of competitors supplies of crude oil, natural gas and NGLs; technological advances affecting energy consumption; andthe price and availability of alternative fuels.']"
90,16,90_leases_expire_acreage_production established,"['leases', 'expire', 'acreage', 'production established', 'unless', 'units', 'acres', 'primary', 'established', 'containing', 'renewed', 'expire years']","['The leases for our net acreage not held by production will expire at the end of their primary term unless production is established in paying quantities under the units containing these leases, the leases are held beyond their primary terms undercontinuous drillingprovisions or the leases are renewed.', 'Unless production is established within the spacing units covering the undeveloped acres on which some of the locations are identified, the leases for such acreage will expire.', '37Table of ContentsCertain of our undeveloped leasehold acreage is subject to leases that will expire over the next several years unless production is established on units containing the acreage, the primary term is extended throughcontinuous drillingprovisions or the leases are renewed.']"
91,16,91_derivative_swaps_exposure_collars,"['derivative', 'swaps', 'exposure', 'collars', 'enter', 'commodity', 'enter derivative', 'flows reduce', 'future enter', 'commodity derivative', 'fluctuations prices', 'portion']","['To achieve more predictable cash flows and reduce our exposure to adverse fluctuations in the prices of oil, NGL and natural gas, we enter into commodity derivative instrument contracts for a portion of our oil, NGL and natural gas production, including puts, swaps, collars, basis swaps and, in the past, call spreads.', 'To achieve more predictable cash flows and to reduce our exposure to adverse fluctuations in the prices of oil and natural gas, we have and may in the future enter into derivative arrangements for a portion of our oil and natural gas production, including, but not limited to, puts, collars and fixedprice swaps.', 'To achieve more predictable cash flows and to reduce our exposure to adverse fluctuations in the prices of crude oil and natural gas, we currently, and may in the future, enter into derivative arrangements for a portion of our crude oil and natural gas production, including collars and fixed-price swaps.']"
92,15,92_common_common stock_stock_conversion,"['common', 'common stock', 'stock', 'conversion', 'convertible notes', 'dividends', 'convertible', 'repurchase shares', 'paying', 'presently', 'repurchase', 'shares']","['The payment of dividends will be at the discretion of our Board of Directors and subject to numerous factors, and we do not presently intend to repurchase any shares of our common stock.', 'The payment of dividends will be at the discretion of our Board of Directors and subject to numerous factors, and we do not presently intend to repurchase any shares of our common stock.', 'In addition, because we have the ability and intent to settle the Convertible Notes, upon conversion, by paying or delivering cash equal to the principal amount of the obligation and common stock for amounts over the principal amount, the shares issuable upon conversion of the Convertible Notes are accounted for using the treasury stock method and, as such, are not included in the calculation of diluted earnings per share except to the extent that the conversion value of the Convertible Notes exceeds their principal amount.']"
93,15,93_current market_value estimated_market value_future net,"['current market', 'value estimated', 'market value', 'future net', 'value', 'value future', 'estimated', 'net', 'net cash', 'assume', 'current', 'gas reserves']","['The present value of future net revenues from our proved reserves will not necessarily be the same as the current market value of our estimated oil and natural gas reserves.', 'You should not assume that the present value of future net cash flows from our proved reserves is the current market value of our estimated reserves.', 'You should not assume that the present value of future net revenues from our proved reserves is the current market value of our estimated oil and natural gas reserves.']"
94,15,94_paris_paris agreement_agreement_emissions targets,"['paris', 'paris agreement', 'agreement', 'emissions targets', 'targets', 'signed', 'international', 'goals', 'countries', 'transparent', 'united', 'calls']","['For example, in April 2016, 195 nations, including Ghana, Mauritania, Sao Tome and Principe, Senegal and the United States, signed and officially entered into an international climate change accord (the Paris Agreement).', 'In February 2021, the US. formally rejoined the Paris Agreement, an international treaty signed by nearly 200 counties which calls for countries to set their own GHG emissions targets and to be transparent about the measures they will implement to achieve their GHG emissions targets.', 'For example, on an international level, in December 2015, almost 200 nations, including Colombia, agreed to an international climate change agreement in Paris, France (the Paris Agreement), that calls for countries to set their own GHG emission targets and be transparent about the measures each country will use to achieve its GHG emission targets.']"
95,15,95_billion_million_50_44,"['billion', 'million', '50', '44', '120', 'approximately 32', 'carryforwards totaling', 'million respectively', '120 countries', 'countries world', 'nol carryforwards', 'totaling']","['8 million, $306.', '1 billion and state of Oklahoma NOL carryforwards totaling $34.', '5 billion.']"
96,15,96_fuel_reduce demand_demand_conservation measures,"['fuel', 'reduce demand', 'demand', 'conservation measures', 'technological', 'fuel conservation', 'conservation', 'technological advances', 'advances', 'energy', 'vehicles', 'alternative']","['Fuel conservation measures, alternative fuel requirements, increasing consumer demand for alternatives to oil and natural gas, technological advances in fuel economy and energy generation devices, and the increased competitiveness of alternative energy sources such as electric vehicles, wind, solar, geothermal, tidal, fuel cells and biofuels) could reduce demand for oil and natural gas and, therefore, our revenues.', 'Fuel conservation measures, alternative fuel requirements, increasing consumer demand for alternatives to natural gas and oil, technological advances in fuel economy and energy generation devices could reduce demand for natural gas and oil.', 'Furthermore, fuel conservation measures, alternative fuel requirements, increasing consumer demand for alternatives to oil and natural gas, technological advances in fuel economy and energy generation devices could reduce demand for oil and natural gas.']"
97,15,97_finance operations_contraction_credit availability_markets lead,"['finance operations', 'contraction', 'credit availability', 'markets lead', 'ability finance', 'global financial', 'volatility global', 'impacting', 'finance', 'financial markets', 'availability', 'reduction']","['Also, disruptions and volatility in the global financial markets may lead to an increase in interest rates or a contraction in credit availability, impacting our ability to finance our operations on favorable terms.', 'Recent and continuing disruptions and volatility in the global financial markets may lead to an increase in interest rates or a contraction in credit availability impacting our ability to finance our operations.', 'Recent and continuing disruptions and volatility in the global financial markets may lead to an increase in interest rates or a contraction in credit availability impacting our ability to finance our operations.']"
98,15,98_december 31_31_refund_december,"['december 31', '31', 'refund', 'december', 'recorded', '31 2021', 'ended december', 'tax', 'ended', 'successor', 'year ended', '2020']","['During the period from January 1, 2020 through November 19, 2020 (Predecessor) and the year ended December 31, 2019 (Predecessor), we recorded non-cash impairment charges of $401.', 'For the year ended December 31, 2021 (Successor), we recorded an immaterial charge for changes in our estimate of expected credit losses.', 'We did not record any impairment charges on unproved properties during the year ended December 31, 2021 (Successor) or the period from November 20, 2020 through December 31, 2020 (Successor).']"
99,15,99_permits_permit_authorities_conduct business,"['permits', 'permit', 'authorities', 'conduct business', 'conduct', 'impede', 'ability profitably', 'enactment', 'ability explore', 'profitably', 'restrict ability', 'regulatory authorities']","['Negative public perception could cause the permits we need to conduct our operations to be withheld, delayed, challenged or burdened by requirements that restrict our ability to profitably conduct our business.', 'If we fail to obtain, maintain or renew permits in a timely manner or at all (due to opposition from partners, community or environmental interest groups, governmental delays or other reasons), or if we face additional requirements imposed as a result of changes in or enactment of laws or regulations, such failure to obtain, maintain or renew permits or such changes in or enactment of laws or regulations could impede or affect our operations, which could have a material adverse effect on our results of operations and financial condition.', 'Delays in obtaining regulatory approvals and drilling permits, including delays that jeopardize our ability to realize the potential benefits from leased properties within the applicable lease periods, the failure to obtain a drilling permit for a well, or the receipt of a permit with unreasonable conditions or costs could have a materially adverse effect on our ability to explore or develop our properties.']"
100,15,100_farmout_land_eminent_proportion,"['farmout', 'land', 'eminent', 'proportion', 'eminent domain', 'farmout party', 'domain', 'entities participate', 'participate wells', 'pooling', 'license areas', 'unitization']","['These entities participate in our wells primarily based on their ownership in leases on which we choose to drill.', 'These entities participate in our wells primarily based on their ownership in leases on which we drill.', 'While our interstate natural gas pipelines in the US. have federal eminent domain authority, the availability of eminent domain authority for our other pipelines varies from state to state depending upon the type of pipelinepetroleum liquids, natural gas, CO2, or crude oiland the laws of the particular state.']"
101,15,101_rate_loan_plus_base rate,"['rate', 'loan', 'plus', 'base rate', 'eurodollar', 'borrowings', 'san', 'mateo', 'san mateo', 'defined', 'equal', 'mateo credit']","['If we borrow funds as a base rate loan, such borrowings will bear interest at a rate equal to the greatest of (i)the prime rate for such day, (ii)the Federal Funds Effective Rate (as defined in the Credit Agreement) on such day, plus 0.', 'If San Mateo borrows funds as a Eurodollar loan, such borrowings will bear interest at a rate equal to (x)the Adjusted LIBO Rate for the chosen interest period plus (y)an amount ranging from 2.', 'If San Mateo borrows funds as a base rate loan, such borrowings will bear interest at a rate equal to the greatest of (i)the prime rate for such day, (ii)the Federal Funds Effective Rate (as defined in the San Mateo Credit Facility) on such day, plus 0.']"
