Topic,Count,Name,Representation,Representative_Docs
75,18,75_derivative_swaps_exposure_instruments,"['derivative', 'swaps', 'exposure', 'instruments', 'enter', 'commodity derivative', 'enter derivative', 'flows reduce', 'future enter', 'commodity', 'fluctuations prices', 'production including']","['To achieve more predictable cash flows and reduce our exposure to adverse fluctuations in the prices of oil, NGL and natural gas, we enter into commodity derivative instrument contracts for a portion of our oil, NGL and natural gas production, including puts, swaps, collars, basis swaps and, in the past, call spreads.', 'To achieve more predictable cash flows and to reduce our exposure to adverse fluctuations in the prices of crude oil and natural gas, we currently, and may in the future, enter into derivative arrangements for a portion of our crude oil and natural gas production, including collars and fixed-price swaps.', 'To achieve more predictable cash flows and to reduce our exposure to adverse fluctuations in the prices of oil and natural gas, we have and may in the future enter into derivative arrangements for a portion of our oil and natural gas production, including, but not limited to, puts, collars and fixedprice swaps.']"
76,18,76_meet obligations_inability_obligations_liquidation,"['meet obligations', 'inability', 'obligations', 'liquidation', 'insolvency', 'meet', 'affect financial', 'significant customers', 'financial results', 'customers', 'separation related', 'contract meet']","['The inability or failure of our significant customers or counterparties to meet their obligations to us or their insolvency or liquidation may adversely affect our financial results.', 'The inability or failure of our significant customers to meet their obligations to us or their insolvency or liquidation may adversely affect our financial results.', 'The inability or failure of our significant customers to meet their obligations to us or their insolvency or liquidation may adversely affect our financial results.']"
77,18,77_title_defects_title defects_acreage,"['title', 'defects', 'title defects', 'acreage', 'properties invest', 'greater risk', 'incur losses', 'paid', 'invest', 'render', 'mineral', 'assignment']","['We may incur losses as a result of title defects in the properties in which we invest.', 'We may incur losses as a result of title defects in the properties in which we invest.', 'Additionally, undeveloped acreage has greater risk of title defects than developed acreage.']"
78,18,78_derivative_expose_expose risk_risk financial,"['derivative', 'expose', 'expose risk', 'risk financial', 'circumstances including', 'financial loss', 'derivative instrument', 'arrangements expose', 'instrument', 'counterparty', 'counterparties', 'circumstances']","['Derivative instruments also expose us to the risk of financial loss in some circumstances, including when: production is less than the volume covered by the commodity derivative instruments; the counter-party to the commodity derivative instrument defaults on its contractual obligations; there is an increase in the differential between the underlying price in the derivative instrument and actual prices received; orthere are issues with regard to legal enforceability of such instruments.', 'Derivative arrangements also expose us to the risk of financial loss in some circumstances, including when: production is less than the volume covered by the derivative instruments; the counterparty to the derivative instrument defaults on its contract obligations; orthere is an increase in the differential between the underlying price and actual prices received in the derivative instrument.', 'Derivative arrangements also expose us to the risk of financial loss in some circumstances, including when: production is less than the volume covered by the derivative instruments; the counterparty to the derivative instrument defaults on its contract obligations; or47Table of Contentsthere is an increase in the differential between the underlying price in the derivative instrument and actual price received.']"
79,17,79_million_billion_million respectively_respectively,"['million', 'billion', 'million respectively', 'respectively', '4billion', 'properties million', 'expenditures required', 'million million', 'unproved oil', 'companys', 'unproved', 'gas properties']","['7 million, $556.', '1 million.', '6 million.']"
80,17,80_volatile_continue volatile_historically_likely continue,"['volatile', 'continue volatile', 'historically', 'likely continue', 'prices volatile', 'continue', 'likely', 'markets oil', 'volatile continue', 'ngls volatile', 'markets', 'market oil']","['These markets will likely continue to be volatile in the future.', 'Historically, the market for oil, NGL and natural gas has been volatile and will likely continue to be volatile in the future.', 'Historically, the markets for oil and natural gas have been volatile and will likely continue to be volatile in the future.']"
81,17,81_sufficient_financing_financing sell_unable negotiate,"['sufficient', 'financing', 'financing sell', 'unable negotiate', 'new financing', 'arrange new', 'sell significant', 'significant assets', 'arrange', 'sell', 'debt', 'sufficient cash']","['If we do not have sufficient funds and are otherwise unable to negotiate renewals of our borrowings or arrange new financing, we may have to sell significant assets.', 'If we do not have sufficient funds and we are otherwise unable to negotiate renewals of our borrowings or arrange new financing, we may have to sell significant assets.', 'If we do not have sufficient funds and are otherwise unable to negotiate renewals of our borrowings or arrange new financing, we may have to sell significant assets.']"
82,17,82_common stock_common_stock_price common,"['common stock', 'common', 'stock', 'price common', 'shares', 'number shares', 'sales', 'market price', 'price', 'shares common', 'market', 'substantial number']","['Future sales of shares of our common stock by existing shareholders and future offerings of our common stock by us could depress the price of our common stock.', 'Sales of a substantial number of shares of our common stock, or the perception in the market that the holders of a large number of shares intend to sell common stock, could reduce the market price of our common stock.', 'The market price of our common stock could decline as a result of sales of a large number of shares of our common stock in the market, including shares of equity or debt securities convertible into common stock, and the perception that these sales could occur may also depress the market price of our common stock.']"
83,17,83_dollars_currency_currencies_canadian,"['dollars', 'currency', 'currencies', 'canadian', 'dollar', 'denominated', 'foreign', 'exchange', 'foreign currency', 'exchange rate', 'fluctuations', 'fluctuations devaluations']","['Foreign currency exchange rate volatility may affect our financial resultsWe sell our oil and natural gas production under agreements that are denominated mainly in US. dollars.', 'This exposure to currencies other than the US. dollar functional currency can lead to impacts on consolidated financial results from foreign currency translation.', 'On occasions, the Canadian business may hold assets or incur liabilities denominated in a currency which is not Canadian dollars which could lead to exposure to foreign exchange rate fluctuations.']"
84,17,84_reserves depleted_reservoir characteristics_depleted_declining,"['reserves depleted', 'reservoir characteristics', 'depleted', 'declining', 'reservoir', 'declining production', 'characteristics', 'vary depending', 'gas reservoirs', 'production rates', 'characterized', 'declines reserves']","['Producing oil and natural gas reservoirs generally are characterized by declining production rates that vary depending upon reservoir characteristics and other factors.', 'Producing oil and natural gas reservoirs generally are characterized by declining production rates that vary depending upon reservoir characteristics and other factors.', 'Producing oil and natural gas reservoirs generally are characterized by declining production rates that vary depending upon reservoir characteristics and other factors.']"
85,17,85_current market_market value_value estimated_future net,"['current market', 'market value', 'value estimated', 'future net', 'net', 'value', 'value future', 'estimated', 'net cash', 'assume', 'current', 'present value']","['The present value of future net revenues from our proved reserves will not necessarily be the same as the current market value of our estimated oil and natural gas reserves.', 'You should not assume that the present value of future net cash flows from our proved reserves is the current market value of our estimated reserves.', 'You should not assume that the present value of future net revenues from our proved reserves is the current market value of our estimated oil and natural gas reserves.']"
86,17,86_inherently_accuracy_assessments_inherently uncertain,"['inherently', 'accuracy', 'assessments', 'inherently uncertain', 'discoveries prospects', 'uncertain', 'data vary', 'characteristics discoveries', 'quality reliability', 'extent quality', 'complex inherently', 'vary']","['The accuracy of these assessments is inherently uncertain.', 'The accuracy of these assessments is inherently uncertain.', 'The accuracy of these assessments is inherently uncertain.']"
87,17,87_substantial capital_require substantial_capital expenditures_substantial,"['substantial capital', 'require substantial', 'capital expenditures', 'substantial', 'expenditures', 'development exploitation', 'projects require', 'capital', 'exploitation', 'exploitation projects', 'make', 'expect']","['See Risks related to our financial positionOur exploration, development and exploitation projects require substantial capital expenditures.', 'See also Risks related to our financial positionOur exploration, development and exploitation projects require substantial capital expenditures.', 'Our exploration, development and exploitation projects require substantial capital expenditures.']"
88,17,88_actual drilling_activities materially_drilling activities_expectations adversely,"['actual drilling', 'activities materially', 'drilling activities', 'expectations adversely', 'materially differ', 'drilling success', 'expectations', 'drilling', 'differ', 'actual', 'materially', 'success']","['Our actual drilling activities may therefore materially differ from our current expectations, which could adversely affect our business.', 'As such, our actual drilling activities may materially differ from our current expectations, which could adversely affect our business.', 'As such, our actual drilling activities may materially differ from our current expectations, which could adversely affect our business, financial condition, results of operations and cash flows.']"
89,16,89_agreement framework_omnibus agreement_omnibus_master agreement,"['agreement framework', 'omnibus agreement', 'omnibus', 'master agreement', 'framework omnibus', 'terms materially', 'separation', 'master', 'materially harm', 'additional costs', 'agreement', 'framework']","['Actual costs related to the separation and the implementation of the changes contemplated by the Master Agreement Framework and the Omnibus Agreement may be higher than anticipated, and we may experience additional difficulties in effecting such changes.', 'RISKS RELATED TO THE SEPARATION FROM GEWe may experience challenges relating to the separation from GE and the anticipated benefits from the Master Agreement Framework and the Omnibus Agreement.', 'We have incurred and expect to continue to incur additional costs in connection with the separation from GE, the Master Agreement Framework and the Omnibus Agreement.']"
90,16,90_additional resources_expend_remediate_required expend,"['additional resources', 'expend', 'remediate', 'required expend', 'enhance', 'investigate remediate', 'investigate', 'vulnerabilities', 'cyber', 'evolve', 'continue evolve', 'protective']","['As cyber threats continue to evolve, we may be required to expend significant additional resources to continue to modify or enhance our protective measures or to investigate and remediate any information security vulnerabilities.', 'As cyber threats continue to evolve, we may be required to expend significant additional resources to continue to modify or enhance our protective measures or to investigate and remediate any information security vulnerabilities.', 'As cyber attacks continue to evolve, we may be required to expend significant additional resources to continue to modify or enhance our protective measures or to investigate and remediate any information security vulnerabilities.']"
91,16,91_quantities present_value reserves_present value_materially affect,"['quantities present', 'value reserves', 'present value', 'materially affect', 'underlying assumptions', 'inaccuracies', 'present', 'quantities', 'affect quantities', 'assumptions materially', 'underlying', 'reserves significant']","['Any significant inaccuracies in these reserve estimates or underlying assumptions will materially affect the quantities and present value of our reserves below.', 'Any significant inaccuracies in these reserve estimates or underlying assumptions will materially affect the quantities and present value of our reserves.', 'Any significant inaccuracies in these reserve estimates or underlying assumptions will materially affect the quantities and present value of our reserves below.']"
92,16,92_rates_ferc_tariff_charged,"['rates', 'ferc', 'tariff', 'charged', 'ferc state', 'utility', 'rates charged', 'file', 'initiate', 'commissions', 'shippers', 'commission']","['Risks Related to RegulationThe FERC or state public utility commissions, such as the CPUC, may establish pipeline tariff rates that have a negative impact on us.', 'If a party with an economic interest were to file either a complaint against our tariff rates or protest any proposed increases to our tariff rates, or FERC were to initiate an investigation of our rates, then our rates could be subject to detailed review.', 'In addition, the FERC, state public utility commissions or our customers could initiate proceedings or file complaints challenging the tariff rates charged by our pipelines, which could have an adverse impact on us.']"
93,16,93_predict_time predict_possible time_enacted,"['predict', 'time predict', 'possible time', 'enacted', 'legislation', 'possible', 'future laws', 'regulations adopted', 'emissions ghgs', 'regulations', 'impact business', 'enacted future']","['Current GHG emissions legislation has not resulted in material compliance costs; however, it is not possible at this time to predict whether proposed legislation or regulations will be adopted, and any such future laws and regulations could result in additional compliance costs or additional operating restrictions.', 'Although it is not possible at this time to predict how legislation or new regulations that may be adopted to address GHG emissions would impact our business, any such future laws and regulations imposing reporting obligations on, or limiting emissions of GHGs from, our equipment and operations could require us to incur costs to reduce emissions of GHGs associated with our operations.', 'Although it is not possible at this time to predict how this legislation or any new regulations that may be adopted to address GHG emissions would impact our business, any such future laws and regulations that limit emissions of GHGs could adversely affect demand for the oil and natural gas that we produce.']"
94,16,94_hedging_rule_qualify non_margin,"['hedging', 'rule', 'qualify non', 'margin', 'non financial', 'derivative instruments', 'end user', 'user', 'qualify', 'mandatory clearing', 'exception', 'mandatory']","['Finally, although the Position Limits Rule does not go into effect with respect to energy products until January 1, 2022, we believe that the majority, if not all, of our hedging activities constitute bona fide hedging under the Position Limits Rule and will not be subject to the limitations under such rule.', 'If any of our swaps do not qualify for the non-financial end-user exception, we could be required 49Table of Contentsto post initial or variation margin, which would impact liquidity and reduce our cash.', 'We also qualify as a non-financial end user for purposes of the Margin Rule; therefore, our uncleared swaps are not subject to regulatory margin requirements.']"
95,16,95_description_safety regulation_occupational health_occupational,"['description', 'safety regulation', 'occupational health', 'occupational', 'health safety', 'safety', 'businessenvironmental', 'regulation discussion', 'items business', 'safety matters', 'regulation', 'matters']","['See ""Item 1. BusinessRegulation of environmental and occupational health and safety matters"" for a further description of the laws and regulations that affect us.', 'See Item 1. BusinessRegulationEnvironmental and occupational health and safety regulation for more discussion on seismicity matters.', 'See Item 1. BusinessRegulationEnvironmental and occupational health and safety regulation for more discussion on these environmental and occupational health and safety matters.']"
96,16,96_debt equity_fund_sale_capital expenditures,"['debt equity', 'fund', 'sale', 'capital expenditures', 'cash', 'issuance', 'relied', 'equity', 'capital', 'cash generated', 'issuance additional', 'proceeds']","['Alternatively, to fund 37Table of Contentsacquisitions, increase our rate of growth, expand our midstream operations, develop our properties or pay for higher service costs, we may decide to alter or increase our capitalization substantially through the issuance of debt or equity securities, the sale of production payments, the sale or joint venture of midstream assets, oil and natural gas producing assets or leasehold interests, the sale or joint venture of oil and natural gas mineral interests, the borrowing of funds or otherwise to meet any increase in capital spending.', 'We intend to finance our future capital expenditures primarily through cash flows provided by operating activities, borrowings under our revolving credit facilities and cash settlements of derivative contracts; however, our financing needs may require us to alter or increase our capitalization substantially through the issuance of additional debt or equity securities or the sale of non-strategic assets.', 'The issuance of additional debt or equity may require that a portion of our cash flows provided by operating activities be used for the payment of principal and interest on our debt, thereby reducing our ability to use cash flows to fund working capital, capital expenditures and acquisitions or to pay dividends.']"
97,16,97_discussion analysis_analysis_analysis financial_discussion,"['discussion analysis', 'analysis', 'analysis financial', 'discussion', 'managements discussion', 'managements', 'item managements', 'item', 'capital resources', 'management discussion', 'condition results', 'item management']","['Please see Part II, Item 7. Managements Discussion and Analysis of Financial Condition and Results of OperationsLiquidity and Capital Resources.', 'Please see Part II, Item 7. Managements Discussion and Analysis of Financial Condition and Results of OperationsLiquidity and Capital Resources.', 'See Item 2. Managements Discussion and Analysis of Financial Condition and Results of OperationsGeneralCOVID-19.']"
98,16,98_laws_regulations_interpreted_changes,"['laws', 'regulations', 'interpreted', 'changes', 'laws regulations', 'sites', 'new', 'new regulations', 'legal', 'environmental laws', 'changes laws', 'regard']","['If existing laws and regulations with regard to hydraulic fracturing are revised or reinterpreted or if new laws and regulations become applicable to our operations through judicial or administrative actions, our business, financial condition, results of operations and cash flows could be adversely affected.', 'In addition, if existing laws and regulations with regard to hydraulic fracturing are revised or reinterpreted or if new laws and regulations become applicable to our operations through judicial or administrative actions, our business, financial condition, results of operations and cash flows could be adversely affected.', 'Even in countries with well-developed legal systems where ExxonMobil does business, we remain exposed to changes in law or interpretation of settled law (including changes that result from international treaties and accords) that could adversely affect our results, such as: increases in taxes, duties, or government royalty rates (including retroactive claims); price controls; changes in environmental regulations or other laws that increase our cost of compliance or reduce or delay available business opportunities (including changes in laws affecting offshore drilling operations, water use, methane emissions, hydraulic fracturing or use of plastics); actions by regulators or other political actors to delay or deny necessary licenses and permits or restrict the transportation of our products; adoption of regulations mandating efficiency standards, the use of alternative fuels or uncompetitive fuel components; adoption of government payment transparency regulations that could require us to disclose competitively sensitive commercial information, or that could cause us to violate the non-disclosure laws of other countries; andgovernment actions to cancel contracts, re-denominate the official currency, renounce or default on obligations, renegotiate terms unilaterally, or expropriate assets.']"
99,15,99_dependent digital_digital_increasingly dependent_dependent,"['dependent digital', 'digital', 'increasingly dependent', 'dependent', 'digital technologies', 'increasingly', 'industry increasingly', 'technologies', 'certain exploration', 'gas industry', 'conduct', 'digital technology']","['The oil and gas industry is increasingly dependent on digital and industrial control technologies to conduct certain exploration, development and production activities.', 'The oil and gas industry has become increasingly dependent on digital technologies to conduct daytoday operations including certain exploration, development and production activities.', 'The oil and natural gas industry has become increasingly dependent on digital technologies to conduct exploration, development, and production activities.']"
100,15,100_leases_expire_acreage_units,"['leases', 'expire', 'acreage', 'units', 'unless', 'acres', 'established', 'primary', 'containing', 'expire years', 'covering', 'spacing units']","['The leases for our net acreage not held by production will expire at the end of their primary term unless production is established in paying quantities under the units containing these leases, the leases are held beyond their primary terms undercontinuous drillingprovisions or the leases are renewed.', 'Unless production is established within the spacing units covering the undeveloped acres on which some of the locations are identified, the leases for such acreage will expire.', 'Certain of our undeveloped leasehold acreage is subject to leases that will expire over the next several years unless production is established on units containing the acreage, the primary term is extended throughcontinuous drillingprovisions or the leases are renewed.']"
101,15,101_immaterial_additional risks_currently consider_known currently,"['immaterial', 'additional risks', 'currently consider', 'known currently', 'currently', 'consider', 'risks described', 'known', 'risks', 'presently', 'ones', 'described']","['Our business could also be affected by additional risks and uncertainties not currentlyknown to us or that we currently consider to be immaterial.', 'Additional risks not presently known to us or which we currently consider immaterial also may adversely affect us.', 'Additional risks not presently known to us or which we currently consider immaterial may also adversely affect us.']"
102,15,102_operating data_data_record_process record,"['operating data', 'data', 'record', 'process record', 'record financial', 'communicate', 'financial operating', 'analyze', 'digital', 'data communicate', 'digital technology', 'seismic']","['We depend on digital technology, including information systems and related infrastructure as well as cloud applications and services, to process and record financial and operating data and to communicate with our employees and business partners.', 'We depend on digital technology, including information systems and related infrastructure as well as cloud application and services, to store, transmit, process and record sensitive information (including trade secrets, employee information and financial and operating data), communicate with our employees and business partners, analyze seismic and drilling information, estimate quantities of oil and gas reserves and for many other activities related to our business.', 'We depend on digital technology, including information systems and related infrastructure as well as cloud application and services, to process and record financial and operating data, communicate with our employees and business partners, analyze seismic and drilling information, estimate quantities of oil and gas reserves and for many other activities related to our business.']"
