Topic,Count,Name,Representation,Representative_Docs
33,28,33_success_retain_management_personnel,"['success', 'retain', 'management', 'personnel', 'technical', 'attract', 'depend ability', 'large extent', 'retain experienced', 'attract retain', 'depend', 'technical personnel']","['Our performance and success are dependent to a large extent on the efforts and continued employment of our management and technical personnel, including our Chairman and Chief Executive Officer, Joseph Wm.', 'Our drilling success and the success of other activities integral to our operations will depend, in part, on our ability to attract and retain experienced geologists, engineers, landmen, and other professionals.', 'In addition, our drilling success and the success of other activities integral to our operations will depend, in part, on our ability to attract and retain experienced geologists, engineers and other professionals.']"
34,28,34_fossil_fossil fuel_funding_pension,"['fossil', 'fossil fuel', 'funding', 'pension', 'companies', 'wealth', 'sovereign', 'funds', 'fuel', 'divestment', 'investment', 'engaged']","['In addition, there have been efforts in recent years aimed at the investment community, including investment advisors, sovereign wealth funds, public pension funds, universities and other groups, promoting the divestment of fossil fuel equities as well as to pressure lenders and other financial services companies to limit or curtail activities with companies engaged in the extraction of fossil fuel reserves, which, if successful, could limit our ability to access capital markets.', 'There also have been efforts in the investment community, including investment advisers and certain sovereign wealth, pension and endowment funds, as well as political actors and other stakeholders, promoting divestment of fossil fuel equities, reducing access to capital markets and pressuring lenders to limit funding or increase the cost of lending to companies engaged in the extraction of fossil fuel reserves.', 'In addition, there have also been efforts in recent years to influence the investment community, including investment advisors and certain family foundations and sovereign wealth, pension and endowment funds, promoting divestment of fossil fuel equities and pressuring lenders to limit funding to companies engaged in the extraction of fossil fuel reserves.']"
35,28,35_viable_know_producing fields_techniques,"['viable', 'know', 'producing fields', 'techniques', 'yield', 'available data', 'drilling', 'quantities', 'economically viable', 'discoveries', 'fields', 'economically']","['Accordingly, we do not know if any of our discoveries or prospects will contain oil or natural gas in sufficient quantities or quality to recover drilling and completion costs or to be economically viable.', 'There is no way to predict in advance of drilling and testing whether any particular location will yield crude oil or natural gas in sufficient quantities to recover drilling or completion costs or to be economically viable.', 'Even when properly used and interpreted, 2D and 3D seismic data and visualization techniques are only tools used to assist geoscientists in identifying subsurface structures and hydrocarbon indicators and do not enable the interpreter to know whether hydrocarbons are, in fact, present in those structures.']"
36,27,36_insurance_uninsured_covered insurance_covered,"['insurance', 'uninsured', 'covered insurance', 'covered', 'coverage', 'insurance coverage', 'occurrence', 'event', 'underinsured', 'fully', 'occurrence event', 'losses']","['The impact of litigation as well as the occurrence of an event that is not fully covered by insurance could have a material adverse effect on our business, financial condition and results of operations.', 'The occurrence of an event that is not fully covered by insurance, or failure by one or more of our insurers to honor its coverage commitments for an insured event, could have a material adverse effect on our business, financial condition and results of operations.', 'The occurrence of an event that is not fully covered by insurance could have a material adverse effect on our business, financial condition and results of operations.']"
37,27,37_intellectual property_intellectual_property rights_rights,"['intellectual property', 'intellectual', 'property rights', 'rights', 'property', 'license', 'trade secrets', 'secrets', 'enforce', 'maintain protect', 'licenses', 'obtain maintain']","['Baker Hughes Company 2021 Form 10-K | 20TECHNOLOGY RISKSAn inability to obtain, maintain, protect or enforce our intellectual property rights could adversely affect our business.', 'Third parties may claim that we have infringed upon or otherwise violated their intellectual property rights.', 'Our intellectual property rights may fail to provide us with significant competitive advantages, particularly in foreign jurisdictions where we have not invested in an intellectual property portfolio or that do not have, or do not enforce, strong intellectual property rights.']"
38,26,38_reserves_decline_replace_proved,"['reserves', 'decline', 'replace', 'proved', 'proved reserves', 'unless', 'reserves production', 'containing', 'successful', 'production decline', 'replace oil', 'successful development']","['Unless we replace our crude oil and natural gas reserves, our reserves and production will decline, which could adversely affect our business, financial condition and results of operations.', 'Unless we replace our oil and natural gas reserves, our reserves and production will decline, which would adversely affect our business, financial condition, results of operations and cash flows.', 'Unless we replace our oil and natural gas reserves, our reserves and production will decline, which would adversely affect our business, financial condition, results of operations and cash flows.']"
39,26,39_injury loss_life_damage_injury,"['injury loss', 'life', 'damage', 'injury', 'loss', 'property', 'loss life', 'destruction property', 'natural resources', 'damage destruction', 'pollution', 'destruction']","['Any of these risks could result in substantial losses due to personal injury and/or loss of life, severe damage to and destruction of property, equipment and natural resources, pollution or other environmental damage, loss of hydrocarbons, disruptions to our operations, regulatory investigations and penalties, suspension of our operations, repair and remediation costs, and loss of sensitive confidential information.', 'Any of these risks could adversely affect our ability to conduct operations or result in substantial losses to us as a result of: injury or loss of life; damage to and destruction of property, natural resources and equipment; 35Table of Contentspollution and other environmental damage and associated clean-up responsibilities; regulatory investigations, penalties or other sanctions; suspension of our operations; andrepair and remediation costs.', 'Any of these risks could adversely affect our ability to conduct operations or result in substantial losses to us as a result of: injury or loss of life; damage to and destruction of property, natural resources and equipment; pollution and other environmental damage; regulatory investigations and penalties; suspension of our operations; andrepair and remediation costs.']"
40,26,40_compliance costs_compliance_laws regulations_revised,"['compliance costs', 'compliance', 'laws regulations', 'revised', 'costs', 'regulations', 'laws', 'increased compliance', 'existing laws', 'result increased', 'regulations revised', 'increase']","['Revised or additional regulations that result in increased compliance costs or additional operating restrictions, particularly if those costs are not fully recoverable from our customers, could have a material adverse effect on our business, financial position, results of operations and prospects.', 'In addition, our costs of compliance may increase if existing laws and regulations are revised or reinterpreted, or if new laws and regulations become applicable to our operations.', 'Our operating and other compliance costs could increase further if existing laws and regulations are revised or reinterpreted, or if new laws and regulations become applicable to our operations.']"
41,26,41_approximately_total_december31 2021_december31,"['approximately', 'total', 'december31 2021', 'december31', '2021', '31', 'undeveloped', 'acres', 'proved', '31 2021', 'december 31', 'basin']","['At December31, 2021, approximately 40% of our total proved reserves were undeveloped and approximately 4% of our total proved reserves were developed non-producing.', 'As of December 31, 2021, approximately 99% of our total net acreage in the Williston Basin was held by production.', 'The combined net acreage expiring over the next three years represents approximately one percent of our total net undeveloped acreage as of December31, 2021.']"
42,26,42_wellhead price_gas wellhead_prices_wellhead,"['wellhead price', 'gas wellhead', 'prices', 'wellhead', 'price receive', 'prices adversely', 'benchmark', 'differential', 'refined', 'increase differential', 'benchmark prices', 'production adversely']","['An increase in the differential between the NYMEX or other benchmark prices of oil and natural gas and the wellhead price we receive for our production could adversely affect our financial condition.', 'An increase in the differential between the NYMEX or other benchmark prices of oil and natural gas and the wellhead price we receive for our production could adversely affect our business, financial condition, results of operations and cash flows.', 'See Risks Related to our Financial ConditionAn increase in the differential between the NYMEX or other benchmark prices of oil and natural gas and the wellhead price we receive for our production could adversely affect our business, financial condition, results of operations and cash flows.']"
43,25,43_quantities present_materially affect_value reserves_present value,"['quantities present', 'materially affect', 'value reserves', 'present value', 'quantities', 'inaccuracies', 'assumptions materially', 'present', 'estimates', 'reserve estimates', 'affect quantities', 'underlying assumptions']","['Any significant inaccuracies in these reserve estimates or underlying assumptions will materially affect the quantities and present value of our reserves below.', 'Any significant inaccuracies in these reserve estimates or underlying assumptions will materially affect the quantities and present value of our reserves.', 'Any significant inaccuracies in these reserve estimates or underlying assumptions will materially affect the quantities and present value of our reserves below.']"
44,25,44_co2_unconventional_latest_geographically concentrated,"['co2', 'unconventional', 'latest', 'geographically concentrated', 'basin', 'shale', 'geographically', 'eor', 'co2 eor', 'completion techniques', 'producing properties', 'texas']","['Almost all of our current oil and natural gas production and our proved reserves are attributable to our properties in the Delaware Basin in Southeast New Mexico and West Texas, the Eagle Ford shale in South Texas and the Haynesville shale in Northwest Louisiana.', 'Furthermore, our exploration and production operations involve using some of the latest drilling and completion techniques developed by us, other operators and service providers.', 'Our operations involve utilizing the latest drilling and completion techniques as developed by us and our service providers in order to maximize cumulative recoveries and therefore generate the highest possible returns.']"
45,25,45_unrest_civil unrest_political_terrorism,"['unrest', 'civil unrest', 'political', 'terrorism', 'countries', 'civil', 'instability', 'social', 'economic', 'armed', 'illegal', 'geopolitical']","['Other political and economic risks include global pandemics; financial market turmoil; economic volatility and global economic slowdown; currency exchange rate fluctuations; short-term and long-term inflationary pressures; import or export restrictions and changes in trade regulations; supply chain disruptions; acts of terrorism, war, civil unrest and other political risks; limitations in the availability of labor to develop, staff and manage operations; and potentially adverse tax developments.', 'In addition, Occidental has experienced and may continue to experience adverse consequences, such as risk of loss or production limitations, because certain of its international operations are located in countries affected by political instability, nationalizations, corruption, armed conflict, terrorism, insurgency, civil unrest, security problems, labor unrest, Organization of the Petroleum Exporting Countries (OPEC) production restrictions, equipment import restrictions and sanctions.', 'These factors include, but are not limited to, the following: uncertain or volatile political, social and economic conditions; 11 exposure to expropriation, nationalization, deprivation or confiscation of our assets or the assets of our customers, or other governmental actions; social unrest, acts of terrorism, war or other armed conflict; public health crises and other catastrophic events, such as the COVID-19 pandemic; confiscatory taxation or other adverse tax policies; theft of, or lack of sufficient legal protection for, proprietary technology and other intellectual property; deprivation of contract rights; trade and economic sanctions or other restrictions imposed by the European Union, the United States or other regions or countries that could restrict or curtail our ability to operate in certain markets; unexpected changes in legal and regulatory requirements, including changes in interpretation or enforcement of existing laws; restrictions on the repatriation of income or capital; currency exchange controls; inflation; and currency exchange, rate fluctuations and devaluations.']"
46,24,46_changes supply_supply_supply demand_minor,"['changes supply', 'supply', 'supply demand', 'minor', 'relatively', 'fluctuations', 'factors control', 'wide fluctuations', 'demand', 'prices', 'ngls', 'feedstocks']","['Crude oil, natural gas and NGLs are commodities and, therefore, their prices are subject to wide fluctuations in response to relatively minor changes in supply and demand.', 'The prices are affected by a number of factors beyond our control, which include: weather conditions and seasonal trends; the domestic and foreign supply of and demand for natural gas, NGLs and oil; prevailing prices on local price indexes in the areas in which we operate and expectations about future commodity prices; national and worldwide economic and political conditions; new and competing exploratory finds of natural gas, NGLs and oil; changes in US. exports of natural gas, NGLs and oil; the effect of energy conservation efforts; the price, availability and consumer demand for alternative fuels; the availability, proximity, capacity and cost of pipelines, other transportation facilities, and gathering, processing and storage facilities and other factors that result in differentials to benchmark prices; technological advances affecting energy consumption and production; the actions of the Organization of Petroleum Exporting Countries; the level and effect of trading in commodity futures markets, including commodity price speculators and others; the cost of exploring for, developing, producing and transporting natural gas, NGLs and oil; risks associated with drilling, completion and production operations; anddomestic, local and foreign governmental regulations, tariffs and taxes, including environmental and climate change regulation.', 'Wide fluctuations in oil, gas, and NGL prices often result from relatively minor changes in the supply of and demand for oil, gas, and NGLs, market uncertainty, and other factors that are beyond our control, including: global and domestic supplies of oil, gas, and NGLs, and the productive capacity of the industry as a whole; the level of consumer demand for oil, gas, and NGLs; overall global and domestic economic conditions; weather conditions; the availability and capacity of gathering, transportation, processing, and/or refining facilities in asset-specific or localized areas; liquefied natural gas deliveries to and from the United States; the price and availability of alternative fuels or sources of energy; technological advances in, and regulations affecting, energy consumption and conservation; the ability of the members of the Organization of Petroleum Exporting Countries and other exporting countries to maintain effective oil price and production controls; 22political instability or armed conflict in oil or gas producing regions, such as the escalating tensions currently occurring between Russia and Ukraine; actual or perceived epidemic or pandemic risks; strengthening and weakening of the United States dollar relative to other currencies; inflation; stockholder activism or activities by non-governmental organizations to limit sources of funding or restrict the exploration and production of oil, gas, and NGLs and related infrastructure; andgovernmental regulations and taxes.']"
47,24,47_predict_time predict_possible time_possible,"['predict', 'time predict', 'possible time', 'possible', 'future laws', 'regulations', 'regulations adopted', 'legislation', 'time', 'impact business', 'emissions ghgs', 'enacted']","['It is not possible at this time to predict whether proposed legislation or regulations will be adopted, and any such future laws and regulations could result in additional compliance costs or additional operating restrictions.', 'Although it is not possible at this time to predict how legislation or new regulations that may be adopted to address GHG emissions would impact our business, any such future laws and regulations imposing reporting obligations on, or limiting emissions of GHGs from, our equipment and operations could require us to incur costs to reduce emissions of GHGs associated with our operations.', 'Although it is not possible at this time to predict how this legislation or any new regulations that may be adopted to address GHG emissions would impact our business, any such future laws and regulations that limit emissions of GHGs could adversely affect demand for the oil and natural gas that we produce.']"
48,24,48_seismic activity_activity_regulatory agencies_agencies,"['seismic activity', 'activity', 'regulatory agencies', 'agencies', 'induced seismicity', 'induced', 'seismic', 'seismicity', 'possible', 'injection wells', 'fracturing', 'hydraulic fracturing']","['State and federal regulatory agencies recently have focused on a possible connection between the operation of injection wells used for produced water disposal and the increased occurrence of seismic activity.', 'Further, state and federal regulatory agencies have focused on a possible connection between the operation of injection wells used for oil and gas waste disposal and seismic activity in recent years.', 'State and federal regulatory agencies have recently focused on a possible connection between hydraulic fracturing-related activities, particularly the underground injection of wastewater into disposal wells, and the increased occurrence of seismic activity, and regulatory agencies at all levels are continuing to study the possible linkage between oil and gas activity and induced seismicity.']"
49,24,49_title_defects_title defects_acreage,"['title', 'defects', 'title defects', 'acreage', 'leases', 'lease', 'properties invest', 'properties', 'unproved', 'greater risk', 'incur losses', 'render']","['If there are any title defects or defects in assignment of leasehold rights in properties in which we hold an interest, we will suffer a financial loss.', 'Undeveloped acreage has greater risk of title defects than developed acreage and title insurance is not generally available for oil and gas properties.', 'Additionally, undeveloped acreage has greater risk of title defects than developed acreage.']"
50,23,50_reserves economically_success_highly dependent_finding,"['reserves economically', 'success', 'highly dependent', 'finding', 'acquiring additional', 'acquiring', 'efficiently', 'economically', 'current reserves', 'highly', 'reserves', 'dependent']","['Our future crude oil and natural gas reserves and production, and therefore our cash flows and income, are highly dependent on our success in efficiently developing and exploiting our current reserves and economically finding or acquiring additional recoverable reserves.', 'Our future oil, NGL and natural gas reserves and production, and therefore our future cash flow and results of operations, are highly dependent on our success in efficiently developing and exploiting our current reserves and economically finding or acquiring additional recoverable reserves.', 'Our future oil and natural gas reserves and production, and therefore our cash flow and results of operations, are highly dependent on our success in efficiently developing and exploiting our current reserves and economically finding or acquiring additional recoverable reserves.']"
51,23,51_district_court_district court_decision,"['district', 'court', 'district court', 'decision', 'court district', 'eis', '2020', 'dapl', 'lease sale', 'july', 'california', 'bureau']","['However, in October 2020, the US. District Court for the District of Wyoming found that the BLM exceeded its statutory authority and acted arbitrarily in promulgating the 2016 Waste Prevention Rule.', 'Following this decision by the District Court for the District of Columbia vacating the November 2021 lease sale, there is uncertainty surrounding whether the sale can be revived and whether the single lease in which Kosmos was the apparent high bidder will be awarded.', 'Subsequently, in November 2021, the Biden administration resumed lease sales in the Gulf of Mexico; however, on January 27, 2022, in litigation brought by Friends of the Earth and other plaintiffs, the US. District Court for the District of Columbia vacated the November 2021 lease sale and the related agency decision making process, finding that the Bureau of Ocean Energy Management (BOEM) failed to consider the impact on foreign greenhouse gas emissions if the November 2021 lease sale was not held and the court determined that this failure was a violation of the National Environmental Policy Act.']"
52,23,52_petroleum contracts_petroleum_agreements_contracts,"['petroleum contracts', 'petroleum', 'agreements', 'contracts', 'transportation agreements', 'drill wells', 'contractually', 'enter', 'obligated drill', 'retain exploration', 'sales agreement', 'various petroleum']","['From time to time, we have entered into and may in the future enter into certain oil, natural gas or produced water gathering or transportation agreements, natural gas processing agreements, NGL transportation agreements, produced water disposal agreements or similar commercial arrangements with midstream companies, including San Mateo.', 'See Under the terms of our various license agreements, we are contractually obligated to drill wells and declare any discoveries in order to retain exploration and production rights.', 'Under the terms of our various petroleum contracts, we are contractually obligated to drill wells and declare any discoveries in order to retain exploration and production rights.']"
53,23,53_energy_technologies_solutions_energy transition,"['energy', 'technologies', 'solutions', 'energy transition', 'transition', 'technology', 'carbon', 'lcs', 'ccs', 'adapt', 'advanced', 'emerging']","['Our long-term success depends on our ability to effectively address the energy transition, which will require adapting our technology portfolio to potentially changing government requirements and customer preferences, as well as engaging with our customers to develop solutions to decarbonize oil and gas operations.', 'Our strategy depends on our ability to develop additional technologies and work with our customers and partners to advance new energy solutions such as carbon capture utilization and storage, hydrogen energy, geothermal, and other integrated solutions.', 'ExxonMobil has established a Low Carbon Solutions (LCS) business unit to advance the development and deployment of these technologies and projects, including CCS, hydrogen and advanced biofuels, breakthrough energy efficiency processes, advanced energy-saving materials, and other technologies.']"
54,23,54_attacks_cyber_incidents_assurance,"['attacks', 'cyber', 'incidents', 'assurance', 'security', 'threats', 'procedures controls', 'cyber incidents', 'remain', 'controls', 'incidents attacks', 'certain cyber']","['In addition, certain cyber incidents, such as surveillance, may remain undetected for an extended period.', 'In addition, certain cyber incidents, such as unauthorized surveillance or a cyber breach, may remain undetected for an extended period.', 'Although Occidental has implemented controls and multiple layers of security to mitigate the risks of a cyber attack that it believes are reasonable, there can be no assurance that such cyber security measures will be sufficient to prevent security breaches of its systems from occurring, and if a breach occurs, it may remain undetected for an extended period of time.']"
