Topic,Count,Name,Representation,Representative_Docs
32,30,32_dividends_board directors_board_directors,"['dividends', 'board directors', 'board', 'directors', 'payment', 'payment dividends', 'pay dividends', 'pay', 'dividend', 'considerations', 'discretion', 'common']","['Such payments will depend on, among other things, our available cash, earnings, financial condition, capital requirements, level of indebtedness, stock price, statutory and contractual restrictions applicable to the payment of dividends and other considerations that our Board of Directors deems relevant.', 'Any payment of future dividends will be at the discretion of our board of directors and will depend on, among other things, our earnings, financial condition, capital requirements, level of indebtedness, statutory and contractual restrictions applying to the payment of dividends and other considerations that our board of directors deems relevant.', 'Any payment of future dividends will be at the discretion of our Board of Directors and will depend on, among other things, our earnings, financial condition, capital requirements, level of indebtedness, statutory and contractual restrictions applicable to the payment of dividends and other considerations that our Board of Directors deems relevant.']"
33,30,33_rating_ratings_credit_credit rating,"['rating', 'ratings', 'credit', 'credit rating', 'credit ratings', 'downgrade', 'debt', 'downgrade credit', 'moodys', 'downgrades', 'letters credit', 'letters']","['Downgrades in our credit ratings by various credit rating agencies could impact our access to capital and materially adversely affect our business and financial condition.', 'Any downgrade in our credit rating or announcementthat our credit rating is under review for possibledowngrade could increase the cost associated with any additionalindebtedness we incur.', 'In March 2020, our corporate credit rating from Standard & Poors Rating Services was downgraded from B+ to B- and our corporate credit rating from Moodys Investors Service was downgraded from B1 to B3.']"
34,30,34_hazards_fluids_risks_spills,"['hazards', 'fluids', 'risks', 'spills', 'releases', 'explosions', 'ruptures', 'fires', 'toxic', 'blowouts', 'inherent', 'subject']","['Our E&P activities are subject to all of the operating risks associated with drilling for and producing crude oil and natural gas, including the possibility of: environmental hazards, such as natural gas leaks, crude oil and produced water spills, pipeline and tank ruptures, encountering naturally occurring radioactive materials and unauthorized discharges of brine, well stimulation and completion fluids, toxic gas, such as hydrogen sulfide, or other pollutants into the environment; abnormally pressured formations; shortages of, or delays in, obtaining water for hydraulic fracturing activities; mechanical difficulties, such as stuck oilfield drilling and service tools and casing failure; personal injuries and death; andnatural disasters.', 'Our business is subject to all of the inherent hazards and risks normally incidental to drilling for, producing, transporting and storing natural gas, NGLs and oil, such as fires, explosions, slips, landslides, blowouts, and well cratering; pipe and other equipment and system failures; delays imposed by, or resulting from, compliance with regulatory requirements; formations with abnormal or unexpected pressures; shortages of, or delays in, obtaining equipment and qualified personnel or in obtaining water for hydraulic fracturing activities; adverse weather conditions, such as freeze offs of wells and pipelines due to cold weather; issues related to compliance with environmental regulations; environmental hazards, such as natural gas leaks, oil and diesel spills, pipeline and tank ruptures, encountering naturally occurring radioactive materials, and unauthorized releases of brine, well stimulation and completion fluids, toxic gases or other pollutants into the environment, especially those that reach surface water or groundwater; inadvertent third-party damage to our assets, and natural disasters.', 'These risks are discussed more fully below and include, but are not limited to, risks related to: Risks Relating to our Oil and Natural Gas OperationsWe have limited proved reserves; We face substantial uncertainties in estimating the characteristics of our discoveries and our prospects; Drilling wells is speculative and may not result in any discoveries; Development wells may not result in commercially productive quantities of oil and gas reserves; Our identified drilling and infrastructure locations are scheduled out over time, making them susceptible to uncertainties; We are contractually obligated to drill wells and declare any discoveries in order to retain exploration and production rights; Inability of third parties who contract with us to meet their obligations may adversely affect our financial results; The unit partners respective interests in the Jubilee Unit and Greater Tortue Ahmeyim Unit are subject to redetermination; We are not the operator on all of our license areas and facilities and do not hold all of the working interests in certain of our license areas; Our estimated proved reserves are based on many assumptions that may turn out to be inaccurate; The present value of future net revenues from our proved reserves will not necessarily be the same as the current market value of our estimated oil and natural gas reserves; We may not be able to commercialize our interests in any natural gas produced from our license areas; Our inability to access appropriate equipment and infrastructure in a timely manner may hinder our access to oil and natural gas markets or delay our oil and natural gas production; We are subject to numerous risks inherent to the exploration and production of oil and natural gas; We are subject to drilling and other operational and environmental risks and hazards; Our operations may be materially adversely affected by tropical storms and hurricanes; The development schedule of oil and natural gas projects is subject to delays and cost overruns; Our offshore and deepwater operations involve special risks that could adversely affect our results of operations; We have had disagreements with host governments regarding certain of our rights and responsibilities and may have future disagreements with our host governments; The geographic locations of our licenses in Africa subject us to an increased risk of loss of revenue or curtailment of production from factors specifically affecting those areas; Risks Relating to our Business and Financial ConditionCOVID-19 pandemic and outbreaks of other diseases may adversely affect our business operations and financial condition; A substantial or extended decline in oil and natural gas prices may adversely affect our business, financial condition and results of operations; Our business plan requires substantial additional capital; We may be required to take writedowns of the carrying values of our oil and natural gas assets as a result of decreases in oil and natural gas prices; 35Table of Contents We face various risks associated with increased activism against, or change in public sentiment for, oil and gas exploration and development activities; Deterioration in the credit or equity markets could adversely affect us; We may incur substantial losses and become subject to liability claims as a result of future oil and natural gas operations, for which we may not have adequate insurance coverage; Slower global economic growth rates may materially adversely impact our operating results and financial position; Increased costs and availability of capital could adversely affect our business; Our derivative activities could result in financial losses or could reduce our income; Our commercial debt facility, revolving credit facility, indenture governing the Senior Notes and GoM Term Loan contain certain covenants that may inhibit our ability to make certain investments, incur additional indebtedness and engage in certain other transactions; Provisions of our Senior Notes could discourage an acquisition of us by a third party; Our level of indebtedness may increase and thereby reduce our financial flexibility; We are a holding company and our ability to make payments on our outstanding indebtedness is dependent upon the receipt of funds from our subsidiaries; We may be subject to risks in connection with acquisitions and the integration of significant acquisitions may be difficult; If we fail to realize the anticipated benefits of a significant acquisition, our results of operations may be adversely affected; A cyber incident could result in information theft, data corruption, operational disruption, and/or financial loss; Outbreaks of disease may adversely affect our business operations and financial condition; Our ability to utilize net operating loss carryforwards may be subject to certain limitations; Changes in the method of determining LIBOR, or the replacement of LIBOR with an alternative reference rate, may adversely affect interest expense related to outstanding debt; Risks Relating to RegulationOur business, operations and financial condition may be directly and indirectly adversely affected by political and economic circumstances; More comprehensive and stringent regulation in the US. Gulf of Mexico has materially increased costs and delays in offshore oil and natural gas exploration and production operations; The oil and gas industry is intensely competitive and many of our competitors possess and employ substantially greater resources than us; Participants in the oil and gas industry are subject to numerous laws, regulations, and other legislative instruments that can affect the cost, manner or feasibility of doing business; We are subject to numerous health, safety and environmental laws and regulations which may result in material liabilities and costs; We may be exposed to assertions concerning or liabilities under anticorruption laws; Federal regulatory law could have an adverse effect on our ability to use derivative instruments; General Risk FactorsWe are dependent on certain members of our management and technical team; We operate in a litigious environment; We face various risks associated with global populism; Our share price may be volatile, and purchasers of our common stock could incur substantial losses; A substantial portion of our total issued and outstanding common stock may be sold into the market at any time; andHolders of our common stock will be diluted if additional shares are issued.']"
35,29,35_regulatory initiatives_delays_restrictions delays_increased,"['regulatory initiatives', 'delays', 'restrictions delays', 'increased', 'initiatives relating', 'initiatives', 'legislative regulatory', 'operating restrictions', 'relating hydraulic', 'restrictions', 'hydraulic fracturing', 'hydraulic']","['Federal, state and local legislative and regulatory initiatives relating to hydraulic fracturing and governmental reviews of such activities could result in increased costs and additional operating restrictions or delays in the completion of natural gas and oil wells, which could adversely affect our production.', 'Federal and state legislative and regulatory initiatives relating to hydraulic fracturing could result in increased costs and additional operating restrictions or delays.', 'Federal, state and local legislative and regulatory initiatives relating to hydraulic fracturing as well as governmental reviews of such activities could result in increased costs and additional operating restrictions or delays in the completion of crude oil and natural gas wells and adversely affect our production.']"
36,29,36_nymex_wti_henry_henry hub,"['nymex', 'wti', 'henry', 'henry hub', 'hub', 'ranged', 'price', 'barrel', '2020', '63', 'hub natural', 'bbl']","['The daily spot prices for NYMEX Henry Hub natural gas ranged from a high of $3.', 'During 2020, the daily spot prices for NYMEX West Texas Intermediate crude oil (NYMEX WTI) ranged from a high of $63.', 'For example, over the last five years, monthly NYMEX WTI oil and NYMEX Henry Hub gas prices ranged from highs of over $67 per Bbl and $4.']"
37,29,37_december31 2020_december31_total_approximately,"['december31 2020', 'december31', 'total', 'approximately', 'proved', '2020', 'percent', 'undeveloped', '2020 approximately', 'proved reserves', 'acres', 'total proved']","['As of December31, 2020, approximately 37 percent of our estimated proved reserves (by volume) were undeveloped.', 'During 2020, approximately 22% of the Companys total production was at fields operated by others, while at December31, 2020, approximately 13% of the Companys total proved reserves were at fields operated by others.', 'At December31, 2020, approximately 54% of our total proved reserves were undeveloped and less than 1% of our total proved reserves were developed non-producing.']"
38,29,38_intellectual_intellectual property_property rights_rights,"['intellectual', 'intellectual property', 'property rights', 'rights', 'property', 'ghanaian', 'secrets', 'trade secrets', 'disagreements', 'enforce', 'patent', 'maintain protect']","['Limitations on our ability to obtain, maintain, protect or enforce our intellectual property rights, including our trade secrets, could cause a loss in revenue and any competitive advantage we hold.', 'Third parties may claim that we have infringed upon, misappropriated or otherwise violated their intellectual property rights.', 'Our intellectual property rights may fail to provide us with significant competitive advantages, particularly in foreign jurisdictions where we have not invested in an intellectual property portfolio or that do not have, or do not enforce, strong intellectual property rights.']"
39,29,39_climate change_climate_emissions_change,"['climate change', 'climate', 'emissions', 'change', 'greenhouse', 'increased operating', 'result increased', 'gases', 'legislation', 'costs reduced', 'demand', 'greenhouse gases']","['Climate change laws and regulations restricting emissions of greenhouse gases could result in increased operating costs and reduced demand for the natural gas, NGLs and oil that we produce while potential physical effects of climate change could disrupt our production and cause us to incur significant costs in preparing for or responding to those effects.', 'Legislation or regulations restricting emissions of greenhouse gases could result in increased operating costs and reduced demand for the oil, natural gas and NGLs we produce, while the physical effects of climate change could disrupt our production and cause us to incur significant costs in preparing for or responding to those effects.', 'The adoption of climate change legislation or regulations restricting emissions of ""greenhouse gases"" could result in increased operating costs and reduced demand for the oil, NGL and natural gas we produce, while potential physical effects of climate change could disrupt our operations and cause us to incur significant costs in preparing for or responding to those effects.']"
40,28,40_ghg_emissions_ghg emissions_cap trade,"['ghg', 'emissions', 'ghg emissions', 'cap trade', 'cap', 'reduce emissions', 'legislation', 'regional', 'programs', 'greenhouse', 'ghgs', 'regulate']","['However, in the current absence of federal legislation to significantly reduce emissions of greenhouse gases to date, many state governments have established rules aimed at reducing greenhouse gas emissions, some including greenhouse gas cap and trade programs.', 'In the absence of such federal climate legislation, a number of state and regional efforts have emerged that are aimed at tracking and/or reducing GHG emissions by means of cap-and-trade programs that typically require major sources of GHG emissions, such as electric power plants, to acquire and surrender emission allowances in return for emitting those GHGs.', 'The United States Congress has from time to time considered adopting legislation to reduce emissions of GHGs, and almost one-half of the states have already taken measures to reduce emissions of GHGs through various measures, including, primarily through the planned development of GHG emission inventories, participation in and/or regional GHG cap and trade programs, and/or transition to clean energy.']"
41,28,41_viable_producing fields_know_techniques,"['viable', 'producing fields', 'know', 'techniques', 'available data', 'yield', 'economically viable', 'discoveries', 'drilling', 'quantities', 'fields', 'economically']","['There is no way to predict in advance of drilling and testing whether any particular location will yield crude oil or natural gas in sufficient quantities to recover drilling or completion costs or to be economically viable.', 'Accordingly, we do not know if any of our discoveries or prospects will contain oil or natural gas in sufficient quantities or quality to recover drilling and completion costs or to be economically viable.', 'Even when properly used and interpreted, 2D and 3D seismic data and visualization techniques are only tools used to assist geoscientists in identifying subsurface structures and hydrocarbon indicators and do not enable the interpreter to know whether hydrocarbons are, in fact, present in those structures.']"
42,28,42_insurance_covered insurance_uninsured_covered,"['insurance', 'covered insurance', 'uninsured', 'covered', 'occurrence', 'event', 'occurrence event', 'fully', 'coverage', 'insured', 'insurance coverage', 'results operations']","['The occurrence of an event that is not fully covered by insurance, or failure by one or more of our insurers to honor its coverage commitments for an insured event, could have a material adverse effect on our business, financial condition and results of operations.', 'The impact of litigation as well as the occurrence of an event that is not fully covered by insurance could have a material adverse effect on our business, financial condition and results of operations.', 'The occurrence of an event that is not fully covered by insurance could have a material adverse effect on our business, financial condition and results of operations.']"
43,28,43_cftc_dodd frank_dodd_frank,"['cftc', 'dodd frank', 'dodd', 'frank', 'swaps', 'frank act', 'act', 'clearing', 'futures', 'limits', 'position limits', 'clearing exchange']","['Although some of the rules necessary to implement the Dodd-Frank Act have yet to be adopted, the CFTC, the SEC and Prudential Regulators have issued numerous rules, including the End-User Exception, which exempts certain end-users from having to comply with mandatory clearing, a Margin Rule mandating margining for certain uncleared swaps, and a Position Limits Rule imposing federal position limits on certain futures contracts relating to energy products, including natural gas.', 'The Dodd-Frank Act and CFTC rules have also designated certain types of swaps (thus far, only certain interest rate swaps and credit default swaps) for mandatory clearing and exchange trading, and may designate other types of swaps for mandatory clearing and exchange trading in the future.', 'The Dodd-Frank Act requires the Commodity Futures Trading Commission (CFTC) and the SEC to promulgate rules and regulations implementing the Dodd-Frank Act.']"
44,28,44_interruptions_processing transportation_production wells_weather,"['interruptions', 'processing transportation', 'production wells', 'weather', 'transportation', 'processing', 'capacity', 'disproportionately', 'constraints', 'capacity constraints', 'facilities', 'interruptions production']","['As a result of this concentration, we may be disproportionately exposed to the impact of regional supply and demand factors, delays or interruptions of production from wells in these areas caused by, and costs associated with, governmental regulation, state and local political activities, processing or transportation capacity constraints, market limitations, availability of equipment and personnel, water shortages or other weather-related conditions, interruption of the processing or transportation of natural gas, 32Table of ContentsNGLs or oil and changes in state and local laws, judicial precedents, political regimes and regulations.', 'As a result, we may be disproportionately exposed to the impact of economics in the Williston Basin and the Permian Basin or delays or interruptions of production from those wells caused by transportation capacity constraints, curtailment of production, availability of equipment, facilities, personnel or services, significant governmental regulation, natural disasters, adverse weather conditions, plant closures for scheduled maintenance or interruption of transportation of crude oil or natural gas produced from the wells in those areas.', 'As a result of this concentration, we may be disproportionately exposed to the impact of regional transportation constraints, supply and demand factors, delays or interruptions of production from wells in this area caused by governmental regulation, processing and storage capacity constraints, market limitations, water shortages, interruption of the processing or transportation of oil or natural gas, as well as impacts from extreme weather or other natural disasters impacting the Permian Basin, such as the freezing of wells and pipelines in the Permian Basin or a decision by ERCOT to implement statewide electricity blackouts due to supply/demand imbalances in the electricity grid caused by the extreme cold weather.']"
45,27,45_assurance_petroleum contracts_provide assurance_specifications,"['assurance', 'petroleum contracts', 'provide assurance', 'specifications', 'able', 'contracts', 'agreements', 'property rights', 'petroleum', 'terms', 'assurance given', 'relinquishment']","['We cannot provide assurance that our products will be able to satisfy the specifications or that we will be able to perform the full-scale testing necessary to prove that the product specifications are satisfied in future contract bids or under existing contracts, or that the costs of modifications to our products to satisfy the specifications and testing will not adversely affect our results of operations.', 'There can be no assurance that the steps we take to obtain, maintain, protect and enforce our intellectual property rights will be adequate.', 'There can be no assurance that the steps we take to obtain, maintain, protect and enforce our intellectual property rights will be completely adequate.']"
46,27,46_reduce demand_fuel_demand_energy,"['reduce demand', 'fuel', 'demand', 'energy', 'energy sources', 'reduce', 'fuels', 'alternative energy', 'alternative', 'conservation measures', 'competitiveness', 'demand oil']","['Fuel conservation measures, alternative fuel requirements, increasing consumer demand for alternatives to natural gas and oil, technological advances in fuel economy and energy generation devices could reduce demand for natural gas and oil.', 'Furthermore, fuel conservation measures, alternative fuel requirements, increasing consumer demand for alternatives to oil and natural gas, technological advances in fuel economy and energy generation devices could reduce demand for oil and natural gas.', 'Fuel conservation measures, alternative fuel requirements, increasing consumer demand for alternatives to oil and natural gas, technological advances in fuel economy and energy generation devices, and the increased competitiveness of alternative energy sources could reduce demand for oil and natural gas.']"
47,27,47_decline_reserves_replace_unless,"['decline', 'reserves', 'replace', 'unless', 'successful', 'proved', 'reserves proved', 'production decline', 'proved reserves', 'containing', 'reserves production', 'development activities']","['Therefore, our estimated proved reserves and future oil, gas and NGL production will decline materially as reserves are produced unless we conduct successful exploration and development activities, such as identifying additional producing zones in existing wells, utilizing secondary or tertiary recovery techniques or acquiring additional properties containing proved reserves.', 'Unless we replace our oil and natural gas reserves, our reserves and production will decline, which would adversely affect our business, financial condition, results of operations and cash flows.', 'Unless we replace our oil and natural gas reserves, our reserves and production will decline, which would adversely affect our business, financial condition, results of operations and cash flows.']"
48,26,48_processing_processing facilities_facilities_depends,"['processing', 'processing facilities', 'facilities', 'depends', 'availability proximity', 'capacity gathering', 'owned', 'availability', 'lng', 'proximity capacity', 'capacity', 'owned operated']","['Our delivery of natural gas, NGLs and oil depends upon the availability, proximity and capacity of pipelines, other transportation facilities and gathering and processing facilities primarily owned by third parties, and our ability to contract with these third parties at competitive rates or at all.', 'Our ability to market our production depends in part on the availability, proximity and capacity of gathering systems, pipelines and processing facilities owned by midstream operators, including third parties and OMP.', 'The marketability of our oil, gas, and NGL production depends in part on the availability, proximity, and capacity of gathering systems, processing facilities, pipelines, and other transportation systems, which are generally owned or operated by third parties.']"
