Topic,Count,Name,Representation,Representative_Docs
125,12,125_foran___,"['foran', '', '', '', '', '', '', '', '', '', '', '']","['5 to 1.', '5 to 1.', 'Foran.']"
126,12,126_emissions_emission_allowances_ghg emissions,"['emissions', 'emission', 'allowances', 'ghg emissions', 'install new', 'ghg', 'emission controls', 'new regulatory', 'install', 'control systems', 'increased costs', 'incur increased']","['Adoption of any such laws or regulations could increase our costs to operate and maintain our facilities and could require us to install new emission controls on our facilities, acquire allowances for our GHG emissions, pay taxes related to our GHG emissions and administer and manage a GHG emissions program, and such increased costs could be significant.', 'The adoption of legislation or regulatory programs to reduce GHG emissions could require us to incur increased operating costs, such as costs to purchase and operate emissions control systems, to acquire emissions allowances or comply with new regulatory requirements.', 'The adoption of legislation or regulatory programs to reduce greenhouse gas emissions could require us to incur increased operating costs, such as costs to purchase and operate emissions control systems, to acquire emissions allowances or to comply with new regulatory or reporting requirements.']"
127,11,127_sofr_libor_rate_financing rate,"['sofr', 'libor', 'rate', 'financing rate', 'reference', 'recommended', 'methodologies', 'secured', 'usd', 'usd libor', 'transition', 'replacement']","['Financial industry working groups are developing replacement rates, such as the Secured Overnight Financing Rate (SOFR) discussed below, and methodologies to transition existing agreements that depend on LIBOR as a reference rate; however, we can provide no assurance that market-accepted rates and transition methodologies will be available and finalized at the time of LIBOR cessation.', '19Table of ContentsIn 2018, the Alternative Reference Rates Committee (ARRC), a group of private-market participants convened by the Federal Reserve Board and the New York Fed, recommended an alternative to LIBOR, the Secured Overnight Financing Rate (SOFR).', 'The Alternative Reference Rates Committee, a group of market participants convened under the auspices of the US. Federal Reserve Board and other US. regulators, has recommended the Secured Overnight Financing Rate (SOFR), calculated based on repurchase agreements backed by treasury securities, as its recommended alternative benchmark rate to replace USD LIBOR.']"
128,11,128_threats_procedures controls_assurance_incidents attacks,"['threats', 'procedures controls', 'assurance', 'incidents attacks', 'procedures', 'controls', 'attacks', 'preventing', 'cybersecurity program', 'sufficient prevent', 'controls monitor', 'security']","['There can be no assurance that the systems we have designed to prevent or limit the effects of cyber incidents or attacks will be sufficient to prevent or detect material consequences arising from such incidents or attacks, or to avoid a material adverse impact on our systems after such incidents or attacks do occur.', 'Although we utilize various procedures and controls to monitor these threats and mitigate our exposure to such threats, there can be no assurance that these procedures and controls will be sufficient in preventing security threats from materializing.', 'Although we utilize various procedures and controls to monitor and protect against these threats and to mitigate our exposure to such threats, there can be no assurance that these procedures and controls will be sufficient in preventing security threats from materializing.']"
129,11,129_item 1a_1a_item_statements item,"['item 1a', '1a', 'item', 'statements item', 'refer note', '23table', 'note consolidated', 'refer', 'note', 'consolidated financial', 'contents', 'financial statements']","['ITEM 1A.', 'ITEM 1A.', 'ITEM 1A.']"
130,11,130_water_significant quantities_hydraulic_hydraulic fracturing,"['water', 'significant quantities', 'hydraulic', 'hydraulic fracturing', 'fracturing', 'drilling hydraulic', 'component', 'essential', 'use significant', 'production drilling', 'requires use', 'addition hydraulic']","['Water is an essential component of both the drilling and hydraulic fracturing processes.', 'Water is an essential component of shale crude oil and natural gas production during both the drilling and hydraulic fracturing processes.', 'The hydraulic fracturing process on which we and others in our industry depend to complete wells that will produce commercial quantities of oil, gas, and NGLs requires the use and disposal of significant quantities of water.']"
131,11,131_excessive_obtain insurance_available insurance_elect,"['excessive', 'obtain insurance', 'available insurance', 'elect', 'presented', 'risks generally', 'relative', 'insurance', 'pollution environmental', 'environmental risks', 'believe', 'pollution']","['Also, we may elect not to obtain insurance if we believe that the cost of available insurance is excessive relative to the risks presented.', 'We may elect not to obtain insurance if we believe that the cost of available insurance is excessive relative to the risks presented.', 'In addition, pollution and environmental risks generally are not fully insurable, and we may elect not to obtain insurance for any or all of these risks if we believe that the cost of available insurance is excessive relative to the risks presented.']"
132,11,132_properties geographically_geographically concentrated_geographically_basin,"['properties geographically', 'geographically concentrated', 'geographically', 'basin', 'producing properties', 'texas', 'producing', 'concentrated', 'shale', 'drilling producing', 'appalachian', 'allocation wells']","['Our producing properties are geographically concentrated in the Marcellus Shale in northeast Pennsylvania.', 'Our producing properties are geographically concentrated in the Permian Basin.', 'Substantially all of our producing properties are geographically concentrated in the Appalachian Basin.']"
133,11,133_directors_board directors_board_stockholders,"['directors', 'board directors', 'board', 'stockholders', 'amended restated', 'restated', 'amended', 'preferred stock', 'meetings', 'preferred', 'voting', 'stockholder']","['Our amended and restated certificate of incorporation and amended and restated bylaws may delay or prevent a merger or acquisition that a stockholder may consider favorable by permitting our board of directors to issue one or more series of preferred stock, requiring advance notice for stockholder proposals and nominations, and placing limitations on convening stockholder meetings.', 'Our amended and restated certificate of incorporation authorizes our board of directors to issue preferred stock without any further vote or action by the stockholders.', 'In addition, some provisions of our amended and restated certificate of incorporation and amended and restated bylaws could make it more difficult for a third party to acquire control of us, even if the change of control would be beneficial to our stockholders, including: limitations on the ability of our stockholders to call special meetings; a separate vote of 75% of the voting power of the outstanding shares of capital stock in order for stockholders to amend the bylaws in certain circumstances; our board of directors is divided into three classes with each class serving staggered three-year terms; stockholders do not have the right to take any action by written consent; andadvance notice provisions for stockholder proposals and nominations for elections to the board of directors to be acted upon at meetings of stockholders.']"
134,11,134_data_personal_data protection_privacy,"['data', 'personal', 'data protection', 'privacy', 'regulations standards', 'data information', 'protection laws', 'california', 'data subject', 'sensitive confidential', 'information', 'gdpr']","['We are subject to a number of privacy and data protection laws, rules and directives (collectively, data protection laws) relating to the processing of personal data.', 'This data is subject to governmental regulation at the federal, state, international, national, provincial and local levels in many areas of our business, including data privacy and security laws such as the European Union (EU) General Data Protection Regulation (GDPR) and the California Consumer Privacy Act (CCPA).', 'We may have access to sensitive, confidential, proprietary or personal data or information in certain of our businesses that is or may become subject to various data privacy and security laws, regulations, standards, contractual obligations or customer-imposed controls in the jurisdictions in which we operate.']"
135,11,135_owners_working owners_dependence_owners projects,"['owners', 'working owners', 'dependence', 'owners projects', 'dependence operator', 'operator', 'working', 'ability influence', 'right way', 'renewal', 'unexpected', 'projects']","['Our dependence on the operators and other working interest owners of these projects and our limited ability to influence operations and associated costs, or control the risks, could materially and adversely affect the drilling results, reserves and future cash flows from these properties.', 'These limitations and our dependence on the operator and other working interest owners in these projects could cause us to incur unexpected future costs.', 'Our dependence on the operator and other working interest owners for these projects and our limited ability to influence or control the operation and future development of these properties could materially adversely affect the realization of our targeted returns on capital in drilling or acquisition activities and lead to unexpected future costs.']"
136,11,136_takeover_provisions_change control_discourage,"['takeover', 'provisions', 'change control', 'discourage', 'bylaws', 'certificate', 'law', 'delaware law', 'provisions discourage', 'delaware', 'anti takeover', 'prevent']","['Our certificate of incorporation and by-laws have provisions that discourage corporate takeovers and could prevent stockholders from receiving a takeover premium on their investment, which could adversely affect the price of our common stock.', 'Our amended and restated certificate of incorporation and amended and restated bylaws, as well as Delaware law, contain provisions that could discourage acquisition bids or merger proposals, which may adversely affect the market price of our common stock.', 'Provisions of our certificate of formation, bylaws and Texas law may have anti-takeover effects that could prevent a change in control even if it might be beneficial to our shareholders.']"
137,11,137_internal_controls_internal controls_financial reporting,"['internal', 'controls', 'internal controls', 'financial reporting', 'maintain effective', 'reporting', 'fail maintain', 'maintain', 'effective', 'fail', 'fraud', 'oxley act']","['If we fail to maintain effective internal control over financial reporting in the future, our ability to accurately report our financial results could be adversely affected.', 'If we fail to maintain effective internal control over financial reporting, our ability to accurately report our financial results could be adversely affected.', 'Our efforts to maintain our internal controls may not be successful, and we may be unable to maintain effective controls over our financial 62Table of Contentsprocesses and reporting in the future and comply with the certification and reporting obligations under Sections 302 and 404 of the Sarbanes-Oxley Act.']"
138,11,138_report_estimates_included_reserves,"['report', 'estimates', 'included', 'reserves', 'prepared', 'businessour', 'net revenues', 'proved', 'present value', 'estimated', 'estimated future', 'reserve']","['This report and certain of our other SEC filings contain estimates of our proved oil, gas, and NGL reserves and the present value of estimated future net revenues from those reserves.', 'Please refer to Reserves in Part I, Items 1 and 2 of this report for discussion regarding the prices used in estimating the present value of our proved reserves as of December31, 2020, and to the caption Oil and Gas Reserve Quantities under Critical Accounting Policies and Estimates in Part II, Item 7 of this report for additional information.', 'Proved reserves of crude oil, natural gas liquids (NGL) and natural gas included in this report on pages 102 through110 have been prepared according to the Securities and Exchange (SEC) guidelines by qualified Company personnel or qualified independent engineers based on an unweighted average of crude oil, NGL and natural gas prices in effect at the beginning of each month of the respective year as well as other conditions and information available at the time the estimates were prepared.']"
139,11,139_unclear_remains_prohibitions_federal actions,"['unclear', 'remains', 'prohibitions', 'federal actions', 'lands adversely', 'lapse', 'federal', 'federal lands', 'effective oil', 'operate federal', 'lands', 'restrictions']","['The impact of these federal actions remains unclear, and if the restrictions do not lapse, or other limitations or prohibitions become effective, our drilling locations on federal lands may not be drilled as scheduled.', 'The impact of these federal actions remains unclear, and if the restrictions do not lapse, or other limitations or prohibitions become effective, our oil and natural gas operations on federal lands could be adversely impacted.', 'The impact of these federal actions remains unclear, and if the restrictions do not lapse, or other limitations or prohibitions become effective, our oil and natural gas operations on federal lands could be adversely impacted.']"
140,11,140_financial risk_high degree_involves high_operational financial,"['financial risk', 'high degree', 'involves high', 'operational financial', 'degree', 'involves', 'degree operational', 'high', 'activities involve', 'involve', 'precludes', 'time required']","['19Exploration for oil and natural gas, and development of new formations, is riskyOil and natural gas exploration involves a high degree of operational and financial risk.', 'Exploring for and developing hydrocarbon reserves involves a high degree of technical, operational and financial risk, which precludes definitive statements as to the time required and costs involved in reaching certain objectives.', 'Exploring for and developing hydrocarbon reserves involves a high degree of operational and financial risk, which precludes us from definitively predicting the costs involved and time required to reach certain objectives.']"
141,11,141_impairment_ended december_charges_years ended,"['impairment', 'ended december', 'charges', 'years ended', 'ended', '2019 2018', 'impairments', 'impairment charges', 'recognized', 'recorded', 'unproved', 'gas property']","['For the years ended December 31, 2020, 2019 and 2018, we recorded lease impairments and expirations of $306.', 'During the years ended December 31, 2020, 2019 and 2018, the Predecessor recorded non-cash impairment charges of $401.', 'During the years ended December 31, 2019 and 2018, we recognized impairment charges on our unproved oil and gas properties of $5.']"
142,10,142_increasing attention_attention_resulted increased_governmental investigations,"['increasing attention', 'attention', 'resulted increased', 'governmental investigations', 'private', 'investigations', 'brought', 'gas companies', 'private litigation', 'entities', 'increasing', 'climate change']","['Finally, increasing attention to climate change risks has resulted in an increased possibility of governmental investigations and additional private litigation against Occidental without regard to causation or our contribution to the asserted damage, which could increase our costs or otherwise adversely affect our business.', 'Increasing attention to the risks of climate change has resulted in an increased possibility of lawsuits brought by public and private entities against oil and natural gas companies in connection with their GHG emissions.', 'Finally, increasing attention to the risks of climate change has resulted in an increased possibility of lawsuits or investigations brought by public and private entities against oil and natural gas companies in connection with their greenhouse gas emissions.']"
143,10,143_operating results_economic_financial markets_economy,"['operating results', 'economic', 'financial markets', 'economy', 'earnings continue', 'economy financial', 'duration magnitude', 'conditions changes', 'affected domestic', 'company fully', 'economies financial', 'political developments']","['Murphys operations and earnings have been and will continue to be affected by domestic and worldwide political developments.', 'Slower global economic growth rates may materially adversely impact our operating results and financial position.', 'These potential impacts, while uncertain, could continue to adversely affect global economies and financial markets and result in a persistent economic downturn that could continue to have an adverse effect on the industries in which we and our customers operate and on the demand for our products, our operating results and our future prospects.']"
144,10,144_vulnerable risks_associated operating_geographic area_vulnerable,"['vulnerable risks', 'associated operating', 'geographic area', 'vulnerable', 'centers', 'geographic', 'areas including', 'area', 'areas', 'risks associated', 'producing properties', 'resulting risks']","['Our producing properties are geographically concentrated in the Marcellus Shale in northeast Pennsylvania, making us vulnerable to risks associated with operating in one major geographic area.', 'Substantially all of our producing properties are concentrated in the Appalachian Basin, making us vulnerable to risks associated with operating primarily in one major geographic area.', 'Our producing properties are in a concentrated geographic area, making us vulnerable to risks associated with operating in one major geographic area.']"
145,10,145_owned operated_operated_party service_party,"['owned operated', 'operated', 'party service', 'party', 'rely party', 'systems operations', 'owned', 'operated parties', 'related operations', 'service providers', 'systems', 'providers']","['Such systems and operations include those of San Mateo, as well as other systems and operations owned and operated by third parties.', 'We rely on third-party service providers to conduct drilling and completion and other related operations.', 'We rely on third-party service providers to perform necessary drilling and completion and other related operations.']"
146,10,146_50_25_block_february march,"['50', '25', 'block', 'february march', '24', '45', 'mmbld', 'wctp', 'dt', 'february', 'march', '']","['50% to 1.', '50 or more.', '50% to 2.']"
147,10,147_venezuela_anadarko_settlement_billion,"['venezuela', 'anadarko', 'settlement', 'billion', 'icsid', 'arbitration', 'approximately billion', 'august', 'award', 'expropriation', 'approximately', '2015']","['2 billion, resolving all claims that were or could have been asserted in connection with the May 2009 lawsuit filed by Tronox against Anadarko and Kerr-McGee in the US. Bankruptcy Court for the Southern District of New York.', 'Additionally, in March 2019, an ICSID arbitration tribunal issued an awardunanimously ordering the government of Venezuela to pay ConocoPhillips approximately $8.', '(PDVSA) providing for the payment of approximately$2 billion over a five-year period in connectionwith an arbitration award issued by the InternationalChamber of Commerce (ICC) Tribunal in favor of ConocoPhillips on a contractual dispute arising from Venezuelas expropriation of our interests in the Petrozuata and Hamaca heavy oil ventures and other pre-expropriationfiscal measures.']"
148,10,148_existing potential_deficiencies_assess_familiar,"['existing potential', 'deficiencies', 'assess', 'familiar', 'problems', 'sufficiently', 'review', 'fully', 'potential', 'deficiencies properties', 'existing', 'properties review']","['Our assessment will not reveal all existing or potential problems nor will it permit us to become sufficiently familiar with the properties to fully assess their deficiencies and capabilities.', 'Our review will not reveal all existing or potential problems nor will it permit us to become sufficiently familiar with the assets to fully assess their deficiencies and potential recoverable reserves.', 'Our review will not reveal all existing or potential problems nor will it permit us to become sufficiently familiar with the properties to fully assess their deficiencies and potential recoverable reserves.']"
149,10,149_depends number_number factors_depends_approval,"['depends number', 'number factors', 'depends', 'approval', 'locations depends', 'factors including', 'develop locations', 'timing', 'drilling wells', 'number', 'financial resources', 'ability drill']","['Our ability to drill and develop these locations depends on a number of factors, including oil and natural gas prices, assessment of risks, costs, drilling results, reservoir heterogeneities, the availability of equipment and capital, approval by regulators, lease terms, seasonal conditions and the actions of other operators.', 'The success and timing of exploration and development activities operated by our partners will depend on a number of factors that will be largely outside of our control, including: the timing and amount of capital expenditures; the operators expertise and financial resources; approval of other participants in drilling wells; selection of technology; andthe rate of production of reserves, if any.', 'Our ability to drill and develop these locations depends on a number of factors, including the availability of equipment and capital, approval by block or lease partners and national and state regulators, seasonal conditions, oil prices, assessment of risks, costs and drilling results.']"
150,10,150_recycling_disposal_water_produced water,"['recycling', 'disposal', 'water', 'produced water', 'produced', 'dependent availability', 'injecting', 'response actions', 'flowback produced', 'operators including', 'disposal activities', 'begun']","['We dispose of large volumes of produced water gathered from our drilling and production operations by injecting it into wells pursuant to permits issued to us by governmental authorities overseeing such disposal activities.', 'In response to these actions, operators including us have begun to rely more on recycling of flowback and produced water from well sites as a preferred alternative to disposal.', 'In response to these actions, operators including us have begun to rely more on recycling of flowback and produced water from well sites as a preferred alternative to disposal.']"
151,10,151_fair_fair value_derivative instruments_earnings,"['fair', 'fair value', 'derivative instruments', 'earnings', 'significantly result', 'instruments', 'result changes', 'fluctuate significantly', 'value', 'gain loss', 'derivative', 'fair market']","['Accordingly, our earnings may fluctuate significantly as a result of changes in the fair market value of our derivative instruments, including a decrease in earnings if the price of commodities increases above the price of hedges that we have in place.', 'Accordingly, our earnings may fluctuate significantly as a result of changes in the fair value of our derivative instruments.', 'Accordingly, our earnings may fluctuate significantly as a result of changes in the fair value of our derivative instruments.']"
152,10,152_libor_2021_usd libor_usd,"['libor', '2021', 'usd libor', 'usd', 'july', 'end', 'banks', 'announced', 'authority', '2017', 'reference', 'july 2017']","['For example, on July 27, 2017, the U. K. Financial Conduct Authority announced that it intends to stop persuading or compelling banks to submit LIBOR rates after 2021.', 'In early December 2020, the administrator for LIBOR proposed, subject to market consultation, to end the publication of one week and two month USD LIBOR after December 2021 and remaining USD LIBOR tenors in mid-2023.', 'In July 2017, the United Kingdom Financial Conduct Authority, which regulates LIBOR, announced that it intends to stop compelling banks to submit rates for the calculation of LIBOR after the end of 2021.']"
