Topic,Count,Name,Representation,Representative_Docs
127,12,127_forum_claim_asserting_action,"['forum', 'claim', 'asserting', 'action', 'directors', 'officers employees', 'directors officers', 'breach', 'delaware', 'fiduciary', 'breach fiduciary', 'exclusive forum']","[""The exclusive-forum provision contained in our bylaws could limit our stockholders' ability to obtain a favorable judicial forum for disputes with us or our directors, officers or other employees."", 'Our bylaws provide that, unless we consent in writing to the selection of an alternative forum, the sole and exclusive forum for (1) any derivative action or proceeding brought on behalf of us, (2) any action asserting a claim of breach of a fiduciary duty owed by any current or former director, officer, other employee or agent of Coterra to Coterra or our stockholders, including a claim alleging the aiding and abetting of such a breach of fiduciary duty, (3) any action asserting a claim arising pursuant to any provision of the Delaware General Corporation Law or our bylaws or charter or (4) any action asserting a claim governed by the internal affairs doctrine or asserting an ""internal corporate claim"" shall, to the fullest extent permitted by law, be the Court of Chancery of the State of Delaware (or, if the Court of Chancery does not have jurisdiction, the US. federal district court for the District of Delaware).', 'Pursuant to our second amended and restated certificate of incorporation, unless we consent in writing to the selection of an alternative forum, the Court of Chancery of the State of Delaware is the sole and exclusive forum for (1) any derivative action or proceeding brought on our behalf, (2) any action asserting a claim of breach of a fiduciary duty owed by any of our directors, officers or other employees to us or our stockholders, (3) any action asserting a claim arising pursuant to any provision of the Delaware General Corporation Law or (4) any action asserting a claim governed by the internal affairs doctrine.']"
128,12,128_ranged_nymex_nymex henry_henry hub,"['ranged', 'nymex', 'nymex henry', 'henry hub', 'hub', 'henry', '2021 natural', 'prices 2021', '2021', 'hub natural', 'brent', 'high']","['13 per MMbtu in 2020, based upon the NYMEX Henry Hub natural gas futures contract price for the earliest delivery date.', 'For example, over the last five years, monthly NYMEX WTI oil and NYMEX Henry Hub gas prices ranged from highs of over $80 per Bbl and $6.', '27Table of ContentsThe daily spot prices for NYMEX Henry Hub natural gas ranged from a high of $23.']"
129,11,129_depends number_number factors_factors_approval,"['depends number', 'number factors', 'factors', 'approval', 'depends', 'locations depends', 'timing', 'develop locations', 'operators', 'drilling wells', 'rate production', 'drill develop']","['The success and timing of our drilling and development activities on properties operated by others therefore depends upon a number of factors, including: the timing and amount of capital expenditures; the operators expertise and financial resources; the rate of production of reserves, if any; approval of other participants in drilling wells; andselection and implementation or execution of technology.', 'The success and timing of exploration and development activities will depend on a number of factors that will be largely outside of our control, including: the timing and amount of capital expenditures; if the activity is operated by one of our block partners, the operators expertise and financial resources; approval of other block partners in drilling wells; the scheduling, predesign, planning, design and approvals of activities and processes; selection of technology; the available capacity of processing facilities and related pipelines; andthe rate of production of reserves, if any.', 'The success and timing of exploration and development activities operated by our partners will depend on a number of factors that will be largely outside of our control, including: the timing and amount of capital expenditures; the operators expertise and financial resources; approval of other participants in drilling wells; selection of technology; andthe rate of production of reserves, if any.']"
130,11,130_strategy_growth strategy_strategic transactions_periodically,"['strategy', 'growth strategy', 'strategic transactions', 'periodically', 'business strategy', 'existing assets', 'new assets', 'appear', 'evaluate', 'assets', 'strategic', 'acquisitions']","['Expanding our existing assets and constructing new assets is part of our growth strategy.', 'We periodically evaluate acquisitions of reserves, properties, prospects and leaseholds and other strategic transactions that appear to fit within our overall business strategy.', 'We periodically evaluate acquisitions of prospects and licenses, reserves and other strategic transactions that appear to fit within our overall business strategy.']"
131,11,131_sources capital_capitalization_sale_debt equity,"['sources capital', 'capitalization', 'sale', 'debt equity', 'proceeds', 'cash generated', 'equity', 'generated operations', 'capital', 'equity securities', 'generated', 'alter']","['We intend to finance our future capital expenditures primarily through cash flows provided by operating activities; however, our financing needs may require us to alter or increase our capitalization substantially through the issuance of additional debt or equity securities or the sale of non-strategic assets.', 'We may be required to alter or increase substantially our capitalization to finance these acquisitions through the use of cash on hand, the issuance of debt or equity securities, the sale of production payments, the sale or joint venture of midstream assets or oil and natural gas producing assets or acreage, the borrowing of funds or otherwise.', 'Alternatively, to fund acquisitions, increase our rate of growth, expand our midstream operations, develop our properties or pay for higher service costs, we may decide to alter or increase our capitalization substantially through the issuance of debt or equity securities, the sale of production payments, the sale or joint venture of midstream assets, oil and natural gas producing assets or leasehold interests, the sale or joint venture of oil and natural gas mineral interests, the borrowing of funds or otherwise to meet any increase in capital spending.']"
132,11,132_scrutiny_stakeholders_esg_investors stakeholders,"['scrutiny', 'stakeholders', 'esg', 'investors stakeholders', 'related esg', 'increased scrutiny', 'face increased', 'business face', 'media', 'investor public', 'face', 'methodologies']","['Companies across all industries are facing increasing scrutiny from stakeholders related to their ESG practices.', 'Our business may face increased scrutiny from investors and other stakeholders related to our sustainability activities, including the goals, targets, and objectives that we announce, and our methodologies and timelines for pursuing them.', 'Our business may face increased scrutiny from investors and other stakeholders related to our ESG initiatives, including our publicly announced targets, as well as our methodologies and timelines for pursuing those initiatives.']"
133,11,133_minimize_risk management_management_management systems,"['minimize', 'risk management', 'management', 'management systems', 'results depend', 'inherent', 'rigorous', 'inherent risks', 'continuous', 'framework', 'risks hazards', 'comprehensive']","['Chevrons risk management systems are designed to assess potential physical and other risks to its operations and assets and to plan for their resiliency.', 'Our results depend on managements ability to minimize the inherent risks of oil, gas, and petrochemical operations, to control effectively our business activities, and to minimize the potential for human error.', 'The companys operations have inherent risks and hazards that require significant and continuous oversight Chevrons results depend on its ability to identify and mitigate the risks and hazards inherent to operating in the crude oil and natural gas industry.']"
134,11,134_item 1a_1a_item_contents,"['item 1a', '1a', 'item', 'contents', '44table contents', 'foran', '44table', 'ii item', 'ii', '', '', '']","['ITEM 1A.', 'ITEM 1A.', 'ITEM 1A.']"
135,11,135_controls_internal_internal controls_financial reporting,"['controls', 'internal', 'internal controls', 'financial reporting', 'maintain effective', 'reporting', 'fail maintain', 'maintain', 'effective', 'fail', 'fraud', 'oxley']","['If we fail to maintain effective internal control over financial reporting, our ability to accurately report our financial results could be adversely affected.', 'If we fail to maintain effective internal control over financial reporting in the future, our ability to accurately report our financial results could be adversely affected.', 'Our efforts to maintain our internal controls may not be successful, and we may be unable to maintain effective controls over our financial processes and reporting in the future and comply with the certification and reporting obligations under Sections 302 and 404 of the Sarbanes-Oxley Act.']"
136,11,136_unit_interests_jubilee_uuoa,"['unit', 'interests', 'jubilee', 'uuoa', 'block', 'respective interests', 'jubilee unit', 'respective', 'greater tortue', 'ahmeyim', 'contributed', 'tortue']","['The parties to the Jubilee UUOA, the collective interest holders in each of the WCTP and DT Blocks, initially agreed that interests in the Jubilee Unit will be shared equally, with each block deemed to contribute 50% of the area of such unit.', 'The respective interests in the Greater Tortue Ahmeyim Unit were therefore initially determined by the respective interests in such contributed block interests.', 'The unit partners respective interests in the Jubilee Unit and Greater Tortue Ahmeyim Unit are subject to redetermination and our interests in each such unit may decrease as a result.']"
137,11,137_million_million million_bcf natural_ton,"['million', 'million million', 'bcf natural', 'ton', '200 bcf', 'bcf', 'government ghana', 'granted', '200', 'jubilee field', '75', 'methane emissions']","['0 million.', '0 million, of which $125.', '0 million of 6.']"
138,11,138_properties areas_partially_depleted_offset,"['properties areas', 'partially', 'depleted', 'offset', 'actions operators', 'certain wells', 'wells adversely', 'wellbore', 'drilling new', 'migration', 'away existing', 'vicinity']","['Many of our properties are in areas that may have been partially depleted or drained by offset wells and certain of our wells may be adversely affected by actions other operators may take when drilling, completing or operating wells that they own.', 'Many of our properties are in areas that may have been partially depleted or drained by offset wells and certain of our wells may be adversely affected by actions other operators may take when drilling, completing, or operating wells that they own.', 'Certain of our properties are in areas that may have been partially depleted or drained by offset wells, and certain of our wells may be adversely affected by actions other operators may take when drilling, completing or operating wells that they own.']"
139,11,139_periodic shortages_equipment_shortages_supplies qualified,"['periodic shortages', 'equipment', 'shortages', 'supplies qualified', 'qualified', 'periodic', 'field', 'personnel', 'rigs', 'intensify', 'intensify competition', 'personnel lead']","['The demand for and availability of qualified and experienced personnel to drill and complete wells and conduct field operations, including, but not limited to, frac crews, geologists, geophysicists, engineers and other professionals in the oil and natural gas industry can fluctuate significantly, often in correlation with oil, NGL and natural gas prices, causing periodic shortages.', 'This limits our ability to operate in those areas and can intensify competition during those months for drilling rigs, oilfield equipment, services, supplies and qualified personnel, which may lead to periodic shortages.', 'This limits our ability to operate in those areas and can intensify competition during those times for drilling rigs and completion equipment, oil field equipment, services, supplies and qualified personnel, which may lead to periodic shortages.']"
140,11,140_security threats_threats_assets specific_computer viruses,"['security threats', 'threats', 'assets specific', 'computer viruses', 'specific targets', 'reputation', 'targets', 'security', 'cyber sabotage', 'terrorism', 'viruses', 'business negatively']","['Our business could be negatively impacted by security threats, including cybersecurity threats, terrorism, armed conflict, and other disruptions.', 'The US. government has issued public warnings that indicate that energy assets might be specific targets of cyber security threats.', 'Our business could be negatively impacted by disruption of electronic systems, security threats, including cyber-security threats, and other disruptions.']"
141,11,141_based assumptions_inaccurate_turn inaccurate_assumptions turn,"['based assumptions', 'inaccurate', 'turn inaccurate', 'assumptions turn', 'reserves based', 'assumptions', 'based', 'reserves estimates', 'estimates', 'net proved', 'engineers', 'reserve']","['For a discussion of the uncertainty involved in these processes, see Our estimated net proved reserves are based on many assumptions that may turn out to be inaccurate.', 'Our estimated net proved reserves are based on many assumptions that may turn out to be inaccurate.', 'See also Our estimated net proved reserves are based on many assumptions that may turn out to be inaccurate.']"
142,10,142_ebitda_ratio defined_ratio_defined,"['ebitda', 'ratio defined', 'ratio', 'defined', 'divided', 'san', 'mateo', 'san mateo', 'quarter ebitda', 'rolling quarter', 'ebitda calculation', 'calculation']","['The San Mateo Credit Facility also requires San Mateo to maintain an interest coverage ratio, which is defined as a rolling four quarter EBITDA calculation divided by San Mateos consolidated interest expense for such period, of 2.', 'The San Mateo Credit Facility also requires San Mateo to maintain an interest coverage ratio, which is defined as a rolling four quarter EBITDA calculation divided by San Mateos consolidated interest expense, of 2.', 'The San Mateo Credit Facility requires San Mateo to maintain a debt to EBITDA ratio, which is defined as total consolidated funded indebtedness outstanding (as defined in the San Mateo Credit Facility) divided by a rolling four quarter EBITDA calculation, of 5.']"
143,10,143_acquired_integrating_challenge_acquisitions,"['acquired', 'integrating', 'challenge', 'acquisitions', 'strategic transactions', 'significant acquisitions', 'integration', 'acquired operations', 'strategic', 'businesses properties', 'andthe', 'transactions']","['These difficulties include: the challenge of integrating the acquired businesses and properties while carrying on the ongoing operations of our business; the inability to retain key employees of the acquired business; the challenge of inconsistencies in standards, controls, procedures and policies of the acquired business; potential unknown liabilities, unforeseen expenses or higher-than-expected integration costs; an overall post-completion integration process that takes longer than originally anticipated; potential lack of operating experience in a geographic market of the acquired properties; andthe possibility of faulty assumptions underlying our expectations.', 'Significant acquisitions and other strategic transactions may involve other risks, including: diversion of our managements attention to evaluating, negotiating and integrating significant acquisitions and strategic transactions; the challenge and cost of integrating acquired operations, information management and other technology systems and business cultures with those of ours while carrying on our ongoing business; difficulty associated with coordinating geographically separate organizations; andthe challenge of attracting and retaining personnel associated with acquired operations.', 'Significant acquisitions and other strategic transactions may involve other risks, including: diversion of our managements attention to evaluating, negotiating and integrating significant acquisitions and strategic transactions; the challenge and cost of integrating acquired operations, information management and other technology systems and business cultures with those of our operations while carrying on our ongoing business; difficulty associated with coordinating geographically separate organizations; an inability to secure, on acceptable terms, sufficient financing that may be required in connection with expanded operations and unknown liabilities; andthe challenge of attracting and retaining personnel associated with acquired operations.']"
144,10,144_accruals_benefit_benefit plans_postretirement benefit,"['accruals', 'benefit', 'benefit plans', 'postretirement benefit', 'estimates', 'postretirement', 'timing future', 'expenditures', 'changes material', 'pud reserves', 'currently anticipate', 'pud']","['Judgments and estimates to determine accruals related to legal, governmental and regulatory proceedings could change from period to period, and such changes could be material.', 'Assumptions used in determining projected benefit obligations and the expected return on plan assets for our pension plans and other postretirement benefit plans are evaluated by us based on a variety of independent sources of market information and in consultation with outside actuaries.', '24Areas requiring significant estimates and assumptions by management include impairments to property, plant and equipment and investments in affiliates; estimates of crude oil and natural gas recoverable reserves; accruals for estimated liabilities, including litigation reserves; and measurement of benefit obligations for pension and other postretirement benefit plans.']"
145,10,145_control ability_control factors_factors control_control,"['control ability', 'control factors', 'factors control', 'control', 'factors', 'regulatory factors', 'credit capital', 'ability generate', 'ability achieve', 'generate cash', 'stated', 'outside control']","['Our ability to achieve our stated targets, including emissions reductions, is subject to numerous factors and conditions, some of which are outside of our control.', 'Our ability to achieve any stated goal, target, or objective, including with respect to emissions reduction, is subject to numerous factors and conditions, some of which are outside of our control.', 'Our ability to generate cash is subject to general economic, financial, competitive, legislative, regulatory and other factors that are beyond our control.']"
146,10,146_unable maintain_technology_maintain_competitive,"['unable maintain', 'technology', 'maintain', 'competitive', 'obsolescence', 'competitive manner', 'cost competitive', 'obsolescence products', 'timely cost', 'advantage hold', 'adversely affected', 'competitive advantage']","['If we are unable to maintain technology leadership, this could adversely affect any competitive advantage we hold.', 'If we are unable to maintain technology leadership in our industry, our ability to maintain market share, defend, maintain or increase prices for our products and services, and negotiate acceptable contract terms with our customers could be adversely affected.', 'If we are unable to continue to develop and produce competitive technology or deliver it to our clients in a timely and cost-competitive manner in various markets in which we operate, or if competing technology accelerates the obsolescence of any of our products or services, any competitive advantage that we may hold, and in turn, our business, financial condition and results of operations could be materially and adversely affected.']"
147,10,147_owned operated_operated_party service_party,"['owned operated', 'operated', 'party service', 'party', 'owned', 'rely party', 'use party', 'systems operations', 'providers', 'related operations', 'operated parties', 'systems']","['In addition to our own systems, we use third-party service providers, who in turn may also use third-party providers, to process certain data or information on our behalf.', 'We rely on third-party service providers to perform necessary drilling and completion and other related operations.', 'We rely on third-party service providers to conduct drilling and completion and other related operations.']"
148,10,148_million_outstanding_borrowings outstanding_borrowings,"['million', 'outstanding', 'borrowings outstanding', 'borrowings', 'outstanding borrowings', '31 2021', 'december 31', 'effect outstanding', 'undrawn', 'covenants noted', 'facility credit', '400']","['As of December 31, 2021, there were no borrowings outstanding under the Corporate Revolver and the undrawn availability was $400.', '0 million in outstanding borrowings under, and approximately $45.', '0 million in borrowings outstanding under the Credit Agreement.']"
149,10,149_reserves depleted_depleted_decline_declines reserves,"['reserves depleted', 'depleted', 'decline', 'declines reserves', 'percent', 'declines', 'rate', 'developed reserves', 'decline time', 'decline rates', 'proved developed', 'production proved']","['Discoveries or Acquisitions of Reserves Are Needed to Avoid a Material Decline in Reserves and Production, and Such Activities Are Capital Intensive The production rates from oil and gas properties generally decline as reserves are depleted, while related per unit production costs generally increase due to decreasing reservoir pressures and other factors.', 'The rate of production from oil and natural gas properties declines as reserves are depleted.', 'The rate of production from our oil and natural gas properties declines as our reserves are depleted.']"
150,10,150_deficiencies_assess_familiar_problems,"['deficiencies', 'assess', 'familiar', 'problems', 'review', 'fully', 'sufficiently', 'potential', 'deficiencies properties', 'existing', 'properties review', 'properties']","['Our assessment will not reveal all existing or potential problems nor will it permit us to become sufficiently familiar with the properties to fully assess their deficiencies and capabilities.', 'Our review will not reveal all existing or potential problems nor will it permit us to become sufficiently familiar with the assets to fully assess their deficiencies and potential recoverable reserves.', 'Our review will not reveal all existing or potential problems nor will it permit us to become sufficiently familiar with the properties to fully assess their deficiencies and potential recoverable reserves.']"
151,10,151_rates increase_alternative reference_rates_costs material,"['rates increase', 'alternative reference', 'rates', 'costs material', 'reference', 'increase', 'expense', 'outstanding borrowings', 'libor', 'increase costs', 'san', 'alternative']","['If interest rates increase, so will our interest costs, which may have a material adverse effect on our results of operations and financial condition.', 'Changes in the method of determining London Interbank Offered Rate (LIBOR), or the replacement of LIBOR with an alternative reference rate, may adversely affect interest expense related to outstanding debt.', 'If we have outstanding borrowings under our Credit Agreement and interest rates increase, so will our interest costs, which may have a material adverse effect on our results of operations and financial condition.']"
152,10,152_month_discounted_average_estimated discounted,"['month', 'discounted', 'average', 'estimated discounted', 'discounted future', 'net', 'net cash', 'future net', 'sec', 'flows proved', 'sec requirements', 'day']","['In accordance with SEC requirements, we base the estimated discounted future net cash flows from our proved reserves on the 12-month average index price for the respective commodity, calculated as the unweighted arithmetic average for the first day of the month price for each month and costs in effect on the date of the estimate, holding the prices and costs constant throughout the life of the properties.', 'The estimated discounted future net cash flows from proved reserves are based on an unweighted arithmetic average of the first-day-of-the-month price for each month within the year in accordance with SEC regulations.', 'In accordance with SEC requirements, we based the discounted future net cash flows from our proved reserves on the twelve-month unweighted arithmetic average of the first-day-of-the-month price for the preceding twelve months without giving effect to derivative transactions.']"
153,10,153_passed_build_house_better,"['passed', 'build', 'house', 'better', 'biden signed', 'congressional', 'november', 'act', 'president biden', 'november 2021', '2021', 'president']","['Although these rules were stayed and ultimately carved back by a September 2020 EPA rule, on June 30, 2021, President Biden signed into law a joint Congressional resolution under the Congressional Review Act disapproving the September 2020 rule.', 'In November 2021, the House of Representatives passed the Build Back Better Act (BBB), which contains several climate-related provisions.', 'Most recently, in November 2021, the US. House of Representatives passed a budget reconciliation bill known as the Build Back Better Act.']"
